Municipio;Localidad;Código postal;Dirección;Margen;Longitud;Latitud;Toma de datos;Precio gasolina 95 E5;Precio gasolina 95 E10;Precio gasolina 95 E5 Premium;Precio gasolina 98 E5;Precio gasolina 98 E10;Precio gasóleo A;Precio gasóleo Premium;Precio gasóleo B;Precio gasóleo C;Precio bioetanol;% bioalcohol;Precio biodiésel;% éster metílico;Precio gases licuados del petróleo;Precio gas natural comprimido;Precio gas natural licuado;Precio hidrógeno;Precio gasolina 95 E25;Precio gasolina 95 E85;Precio AdBlue;Precio diesel renovable;Precio gasolina renovable	;Precio metanol	;Precio  amoniaco	;Precio BGNC	;Precio BGNL;Rótulo;Tipo venta;Rem.;Horario;Tipo servicio;Ultimo dato;Tipo_Vendedor;Provincia;Comunidad_Autonoma;Total población;Población hombres;Población mujeres;Competencia_1km;Competencia_2km;Competencia_5km;Competencia_10km;Competencia_25km;Competencia_50km;Competencia_100km;Distancia_Exolum_km
ABENGIBRE;ABENGIBRE;02250;AVENIDA CASTILLA LA MANCHA, 26;D;-1.539167;39.211417;02/12/2025 11:36;1.399;;;;;1.399;;0.949;;;;;;;;;;;;;;;;;;;Nº 10.935;P;dm;L-D: 07:00-22:00;L-D: 07:00-22:00 (A);2025-12-02;Independiente;Albacete;Castilla - La Mancha;386464.0;193205.0;193259.0;0;0;0;4;23;141;648;107.57035679965882
ALATOZ;ALATOZ;02152;CR CM-332, 46,4;I;-1.346083;39.100389;01/12/2025 23:59;1.599;;;;;1.559;1.609;;;;;;;;;;;;;;;;;;;;REPSOL;P;dm;L-D: 7:00-23:00;L-D: 7:00-23:00 (A);2025-12-01;Petrolera;Albacete;Castilla - La Mancha;386464.0;193205.0;193259.0;0;0;0;0;12;110;875;95.58393650908157
ALBACETE;ALBACETE;02001;CALLE FEDERICO GARCIA LORCA, 1;D;-1.849833;39.000861;01/12/2025 04:15;1.359;;;;;1.325;;;;;;;;;;;;;;;;;;;;;PLENERGY;P;dm;L-D: 24H;L-D: 24H (D);2025-12-01;Descuento;Albacete;Castilla - La Mancha;386464.0;193205.0;193259.0;3;9;36;41;57;125;381;139.1580123519696
ALBACETE;ALBACETE;02001;CALLE FEDERICO GARCIA LORCA, 5;I;-1.846361;38.997722;01/12/2025 14:20;;;;;;1.499;;;;;;;;;;;;;;;;;;;;;MOEVE;R;dm;L-S: 05:00-23:00;L-S: 05:00-23:00 (A);2025-12-01;Petrolera;Albacete;Castilla - La Mancha;386464.0;193205.0;193259.0;4;9;32;39;57;123;380;138.71645290109507
ALBACETE;ALBACETE;02001;AVENIDA 1º DE MAYO, S/N;N;-1.8685;38.985667;03/12/2025 10:38;1.489;;;1.619;;1.429;1.469;;;;;;;;;;;;;;;;;;;;CARREFOUR;P;dm;"L-S: 08:00-22:00; D: 09:00-21:00";"L-S: 08:00-22:00 (A); D: 09:00-21:00 (A)";2025-12-03;Supermercado;Albacete;Castilla - La Mancha;386464.0;193205.0;193259.0;1;11;31;40;56;119;384;139.61195798064165
ALBACETE;ALBACETE;02001;CALLE PRINCIPE DE ASTURIAS (POLÍGONO DE ROMICA), 5;I;-1.832;39.054694;03/12/2025 00:00;1.509;;;1.659;;1.529;1.629;;;;;;;;;;;;;0.99;;;;;;;BP ROMICA;P;OM;L-D: 06:00-22:00;L-D: 06:00-22:00 (P);2025-12-03;Petrolera;Albacete;Castilla - La Mancha;386464.0;193205.0;193259.0;0;0;1;38;61;128;375;136.66387967895272
ALBACETE;ALBACETE;02005;AVENIDA MENÉNDEZ PIDAL, 58;N;-1.864917;39.003333;03/12/2025 12:32;1.509;;;1.639;;1.439;1.535;;;;;;;;;;;;;;;;;;;;TAMOS;P;dm;L: 05:00-01:00;L: 05:00-01:00 (A);2025-12-03;Independiente;Albacete;Castilla - La Mancha;386464.0;193205.0;193259.0;3;14;35;41;55;128;378;140.4021519801837
ALBACETE;ALBACETE;02005;AVENIDA ESCRITOR RODRIGO RUBIO, 3;D;-1.885361;39.006889;30/11/2025 09:46;1.347;;;;;1.297;1.399;;;;;;;0.818;;;;;;;;;;;;;A&A;P;dm;L-S: 09:00-21:30;Sin datos;2025-11-30;Independiente;Albacete;Castilla - La Mancha;386464.0;193205.0;193259.0;4;14;33;41;53;127;384;142.10327167628935
ALBACETE;ALBACETE;02005;CL PASEO DE LA CUBA, 15;D;-1.854556;38.999722;03/12/2025 00:00;1.529;;;1.639;;1.469;;;;;;;;0.959;;;;;;;1.559;;;;;;REPSOL;P;OM;L-D: 06:00-22:00;L-D: 06:00-22:00 (A);2025-12-03;Petrolera;Albacete;Castilla - La Mancha;386464.0;193205.0;193259.0;4;13;36;41;57;122;382;139.4320079828573
ALBACETE;ALBACETE;02005;PASEO CUBA (LA), 36;N;-1.859917;39.005083;03/12/2025 14:00;1.509;;;1.659;;1.439;1.535;;;;;;;0.966;;;;;;;;;;;;;MOEVE;P;OM;L-D: 06:00-22:00;L-D: 06:00-22:00 (P);2025-12-03;Petrolera;Albacete;Castilla - La Mancha;386464.0;193205.0;193259.0;3;11;35;41;55;127;377;140.14459096400898
ALBACETE;ALBACETE;02005;CALLE CONSTANTINO ROMERO, S/N;D;-1.884444;39.005528;02/12/2025 18:00;1.367;;;;;1.317;;;;;;;;;;;;;;;;;;;;;PLENERGY;P;dm;L-D: 24H;L-D: 24H (D);2025-12-02;Descuento;Albacete;Castilla - La Mancha;386464.0;193205.0;193259.0;4;15;33;41;54;127;384;141.955185609769
ALBACETE;ALBACETE;02002;CALLE HERMANOS FALCÓ, 2;D;-1.849028;38.98925;28/11/2025 07:24;1.539;;;1.649;;1.499;1.589;;;;;;;;;;;;;;;;;;;;CEPSA;P;dm;L-D: 06:30-22:30;Sin datos;2025-11-28;Petrolera;Albacete;Castilla - La Mancha;386464.0;193205.0;193259.0;4;12;32;41;57;121;384;138.40135685302306
ALBACETE;ALBACETE;02006;AVDA. DE LOS TOREROS, S/N;N;-1.869889;38.998222;01/12/2025 00:00;1.449;;;;;1.419;1.469;;;;;;;;;;;;;;;;;;;;INPEALSA;P;dm;L-D: 07:00-23:00;L-D: 07:00-23:00 (P);2025-12-01;Independiente;Albacete;Castilla - La Mancha;386464.0;193205.0;193259.0;2;14;35;41;56;124;382;140.45793673801862
ALBACETE;ALBACETE;02006;CARRETERA M 3203 KM. 2,6;D;-1.875944;38.963972;02/12/2025 18:11;1.483;;;;;1.426;1.481;;;;;;;;;;;;;;;;;;;;LA PULGOSA;P;dm;L-D: 06:00-22:00;L-D: 06:00-22:00 (A);2025-12-02;Independiente;Albacete;Castilla - La Mancha;386464.0;193205.0;193259.0;1;1;20;38;53;118;387;138.90008423456288
ALBACETE;ALBACETE;02006;CR N-301, 244;I;-1.892972;39.027778;03/12/2025 14:00;1.519;;;1.619;;1.499;;;;;;;;;;;;;;;1.579;;;;;;REPSOL;P;OM;L-D: 24H;L-D: 24H (A);2025-12-03;Petrolera;Albacete;Castilla - La Mancha;386464.0;193205.0;193259.0;4;9;24;41;57;123;382;142.60895122777276
ALBACETE;ALBACETE;02006;CARRETERA JAEN KM. 2;D;-1.871722;38.994667;01/12/2025 06:00;1.539;;1.579;1.659;;1.489;;;;;;;;;;;;;;1.209;1.579;;;;;;REPSOL;P;dm;L-D: 24H;L-D: 24H (A);2025-12-01;Petrolera;Albacete;Castilla - La Mancha;386464.0;193205.0;193259.0;1;10;35;41;56;122;382;140.38011980935283
ALBACETE;ALBACETE;02006;CALLE CTRA. DE JAEN, 79;I;-1.883694;38.988111;01/12/2025 11:56;1.539;;;1.669;;1.499;;;;;;;;;;;;;;1.199;1.589;;;;;;REPSOL;P;dm;L-D: 06:00-22:00;L-D: 06:00-22:00 (P);2025-12-01;Petrolera;Albacete;Castilla - La Mancha;386464.0;193205.0;193259.0;0;5;34;41;56;122;389;140.87048904796086
ALBACETE;ALBACETE;02006;CALLE ALCALDE CONANGLA (C.C. EROSKI), S/N;N;-1.847361;38.988972;01/12/2025 10:22;1.359;;;1.529;;1.329;1.399;;;;;;;;;;;;;;;;;;;;FAMILY ENERGY;P;dm;"L-S: 07:00-23:00; D: 08:00-23:00";"L-S: 07:00-23:00 (A); D: 08:00-23:00 (A)";2025-12-01;Independiente;Albacete;Castilla - La Mancha;386464.0;193205.0;193259.0;4;11;31;41;57;121;386;138.2632612420219
ALBACETE;ALBACETE;02006;CR N-322, 337,8;I;-2.031861;38.925833;01/12/2025 09:36;1.569;;;1.699;;1.509;1.579;;;;;;;;;;;;;;;;;;;;REPSOL;P;dm;L-D: 06:30-21:30;L-D: 06:30-21:30 (P);2025-12-01;Petrolera;Albacete;Castilla - La Mancha;386464.0;193205.0;193259.0;0;0;1;2;55;109;394;148.65811757949848
ALBACETE;ALBACETE;02006;CARRETERA N-322 KM. 359;D;-1.845083;39.033139;27/11/2025 12:55;1.509;;;1.619;;1.529;1.619;;;;;;;;;;;;;;;;;;;;REPSOL;P;dm;"L-V: 07:00-21:00; S-D: 09:00-14:00";Sin datos;2025-11-27;Petrolera;Albacete;Castilla - La Mancha;386464.0;193205.0;193259.0;0;0;27;39;57;128;377;138.50346300406923
ALBACETE;ALBACETE;02006;PG CAMPOLLANO-P. 2-CT, S.N.;D;-1.874972;39.012583;03/12/2025 00:00;1.519;;;1.629;;1.499;1.569;;;;;;;;;;;;;;;;;;;;REPSOL;P;OM;"L-V: 06:00-22:00; S: 07:30-15:30; D: 09:00-15:00";"L-V: 06:00-22:00 (A); S: 07:30-15:30 (A); D: 09:00-15:00 (A)";2025-12-03;Petrolera;Albacete;Castilla - La Mancha;386464.0;193205.0;193259.0;4;14;32;41;54;129;380;141.6897637877211
ALBACETE;ALBACETE;02006;AVDA. DE ESPAÑA (PRÓX. A C/ SAN JUAN), S/N;N;-1.853306;38.982167;01/12/2025 00:00;1.449;;;;;1.419;;;;;;;;;;;;;;;;;;;;;INPEALSA;P;dm;L-D: 07:00-23:00;L-D: 07:00-23:00 (P);2025-12-01;Independiente;Albacete;Castilla - La Mancha;386464.0;193205.0;193259.0;3;9;28;41;57;120;386;138.29248449427322
ALBACETE;ALBACETE;02006;CARRETERA NACIONAL 322 PTO KM 347 KM. 347;D;-1.9355;38.965639;27/11/2025 07:00;;;;;;1.429;;;;;;;;;;;;;;;;;;;;;P347;P;dm;L-S: 07:00-22:00;L-S: 07:00-22:00 (A);2025-11-27;Independiente;Albacete;Castilla - La Mancha;386464.0;193205.0;193259.0;0;0;0;39;57;117;394;143.43133486762292
ALBACETE;ALBACETE;02006;AVENIDA 1º DE MAYO, S/N;N;-1.866806;38.985194;01/12/2025 16:20;1.459;;;;;1.409;;;;;;;;;;;;;;;;;;;;;PETROCAMP;P;dm;L-D: 07:00-23:00;L-D: 07:00-23:00 (A);2025-12-01;Independiente;Albacete;Castilla - La Mancha;386464.0;193205.0;193259.0;1;10;31;39;56;120;385;139.45992033679502
ALBACETE;ALBACETE;02006;CALLE ALMANSA, 2;I;-1.847083;38.984139;20/11/2025 13:16;1.537;;;1.685;;1.539;1.589;;;;;;;;;;;;;;;;;;;;CEPSA;P;dm;L-D: 06:00-23:00;L-D: 06:00-23:00 (A);2025-11-20;Petrolera;Albacete;Castilla - La Mancha;386464.0;193205.0;193259.0;3;10;27;41;56;122;387;137.95464575160048
ALBACETE;ALBACETE;02099;CARRETERA NACIONAL 301 KM. 256;D;-1.831639;38.929389;01/12/2025 06:00;1.449;;;;;1.409;;;;;;;;;;;;;;0.899;;;;;;;INPEALSA;P;dm;L-D: 24H;"L-S: 00:00-06:00 (D), 06:00-22:00 (P), 22:00-23:59 (D); D: 00:00-07:00 (D), 07:00-22:00 (P), 22:00-23:59 (D)";2025-12-01;Independiente;Albacete;Castilla - La Mancha;386464.0;193205.0;193259.0;0;0;3;28;55;124;395;133.64135240250408
ALBACETE;SANTA ANA;02328;AVENIDA PRINCIPE, 2;D;-1.994028;38.900944;03/12/2025 00:00;1.479;;;1.589;;1.459;;1.164;;;;;;;;;;;;;1.549;;;;;;REPSOL;P;OM;L-D: 08:00-16:00;L-D: 08:00-16:00 (A);2025-12-03;Petrolera;Albacete;Castilla - La Mancha;386464.0;193205.0;193259.0;0;0;1;4;58;107;404;144.49123290756475
ALBACETE;SALOBRAL (EL);02140;CM. 3203 km 14,1;D;-1.9205;38.867556;28/11/2025 14:19;1.39;;;;;1.366;1.86;1.03;;;;;;;;;;;;;;;;;;;LOZANO;P;dm;"L-S: 07:00-14:00; D: 09:00-14:00";Sin datos;2025-11-28;Independiente;Albacete;Castilla - La Mancha;386464.0;193205.0;193259.0;1;1;1;2;56;111;401;137.14006062502034
ALBACETE;SALOBRAL (EL);02099;CTRA.AGUASNUEVAS KM 0,25;D;-1.922722;38.870278;01/12/2025 10:11;;;;;;;;1.03;;;;;;;;;;;;;;;;;;;CORYMAR;R;dm;L-D: 24H;L-D: 24H (A);2025-12-01;Independiente;Albacete;Castilla - La Mancha;386464.0;193205.0;193259.0;1;1;1;2;56;111;404;137.4467634289293
ALBACETE;ALBACETE;02007;MADRID-CARTAGENA km 248,5;D;-1.845278;38.971722;03/12/2025 00:00;1.519;;1.579;;;1.469;1.559;;;;;;;;;;;;;;;;;;;;REPSOL. LOS ANGELES DE LA MANCHA, S.L.;P;OM;L-D: 06:00-22:00;L-D: 06:00-22:00 (A);2025-12-03;Petrolera;Albacete;Castilla - La Mancha;386464.0;193205.0;193259.0;1;6;20;41;56;125;387;137.08816465606634
ALBACETE;ALBACETE;02007;POLIGONO CAMPOLLANO AVENIDA 1, 0;N;-1.893944;39.016389;01/12/2025 00:00;1.449;;;;;1.409;1.459;;;;;;;;;;;;;0.899;;;;;;;INPEALSA;P;dm;"L-V: 06:00-22:00; S: 06:00-14:00";S: 06:00-14:00 (A);2025-12-01;Independiente;Albacete;Castilla - La Mancha;386464.0;193205.0;193259.0;2;15;27;41;54;126;383;143.10215423766633
ALBACETE;ALBACETE;02007;AVENIDA POLIGONO CAMPOLLANO AVENIDA 0, 67;N;-1.886556;39.021583;02/12/2025 15:20;1.499;;;;;1.399;;;;;;;;;;;;;;;;;;;;;VALERO 24H;P;dm;L-D: 24H;L-D: 24H (A);2025-12-02;Independiente;Albacete;Castilla - La Mancha;386464.0;193205.0;193259.0;6;15;28;41;57;126;380;142.30923191951695
ALBACETE;ALBACETE;02007;AVENIDA PRIMERA, S/N;D;-1.882056;39.022139;01/12/2025 18:00;1.345;;;;;1.295;;;;;;;;;;;;;;;;;;;;;GMOIL;P;dm;L-D: 24H;L-D: 24H (A);2025-12-01;Independiente;Albacete;Castilla - La Mancha;386464.0;193205.0;193259.0;5;15;28;40;57;126;379;141.92175562424265
ALBACETE;ALBACETE;02007;POLIGONO CAMPOLLANO, 55;N;-1.871361;39.015444;02/12/2025 20:18;1.499;;;1.629;;1.479;1.539;;;;;;;;;;;;;;;;;;;;CEPSA;P;dm;"L-V: 05:30-23:00; S: 06:30-22:30; D: 07:30-21:00";Sin datos;2025-12-02;Petrolera;Albacete;Castilla - La Mancha;386464.0;193205.0;193259.0;3;14;32;40;56;129;379;141.29744579039402
ALBACETE;ALBACETE;02007;POLIGONO CAMPOLLANO AVENIDA -0-, 69;D;-1.879639;39.021972;01/12/2025 10:45;1.539;;;;;1.389;;;;;;;;;;;;;;;;;;;;;ABOIL;P;dm;"L-V: 07:00-21:00; S-D: 09:00-14:00";"L-V: 07:00-21:00 (P); S-D: 09:00-14:00 (P)";2025-12-01;Independiente;Albacete;Castilla - La Mancha;386464.0;193205.0;193259.0;3;15;30;40;57;126;381;141.73069433337687
ALBACETE;ALBACETE;02007;AUTOVIA A-31 KM. 69;I;-1.891361;39.031528;03/12/2025 14:00;1.509;;;1.629;;1.479;1.549;;;;;;;0.969;;;;;;;;;;;;;REPSOL;P;OM;L-D: 06:00-22:00;L-D: 06:00-22:00 (A);2025-12-03;Petrolera;Albacete;Castilla - La Mancha;386464.0;193205.0;193259.0;3;7;25;41;57;123;382;142.3430356644696
ALBACETE;ALBACETE;02007;POLIGONO AVDA. 3ª, ESQUINA C/AUTOVIA, 69;D;-1.874333;39.018;01/12/2025 10:51;1.459;;;1.599;;1.439;1.499;;;;;;;;;;;;;0.849;;;;;;;ENERCOM CARBURANTES;P;dm;L-D: 24H;L-D: 24H (A);2025-12-01;Independiente;Albacete;Castilla - La Mancha;386464.0;193205.0;193259.0;5;16;31;40;57;129;379;141.4444535110293
ALBACETE;ALBACETE;02007;POLIGONO CAMPOLLANO C/.F, 13;D;-1.889417;39.012472;02/12/2025 17:36;;;;;;1.349;;;;;;;;;;;;;;0.999;;;;;;;AVANZA OIL;P;dm;L-D: 24H;L-D: 24H (A);2025-12-02;Independiente;Albacete;Castilla - La Mancha;386464.0;193205.0;193259.0;4;14;31;40;53;127;383;142.73267023734172
ALBACETE;ALBACETE;02007;AVENIDA 3ª ESQUINA C/ F Nº3, 3;N;-1.885694;39.009417;01/12/2025 11:10;1.419;;;;;1.359;;;;;;;;;;;;;;;;;;;;;FAST & GAS;P;dm;L-D: 24H;L-D: 24H (A);2025-12-01;Independiente;Albacete;Castilla - La Mancha;386464.0;193205.0;193259.0;5;13;32;40;53;127;385;142.27867259803648
ALBACETE;ALBACETE;02007;SECTOR PARCELA T-3 LOCAL52, 14;N;-1.878111;39.009639;02/12/2025 14:54;1.345;;;1.479;;1.295;1.36;;;;;;;;;;;;;;;;;;;;ALCAMPO;P;dm;L-D: 24H;"L-S: 00:00-08:30 (D), 08:30-21:59 (A), 21:59-23:59 (D); D: 24H (D)";2025-12-02;Supermercado;Albacete;Castilla - La Mancha;386464.0;193205.0;193259.0;6;15;32;41;53;129;380;141.74031479522878
ALBACETE;ALBACETE;02007;MADRID-CARTAGENA km 248,5;I;-1.845306;38.971778;03/12/2025 00:00;1.519;;;1.639;;1.469;1.559;;;;;;;;;;;;;;;;;;;;REPSOL Nº ESTACIÓN 97179;P;OM;L-V: 06:00-22:00;L-V: 06:00-22:00 (A);2025-12-03;Petrolera;Albacete;Castilla - La Mancha;386464.0;193205.0;193259.0;1;6;20;41;56;125;387;137.09351065263007
ALBACETE;ALBACETE;02007;CALLE AUTOVIA, SN;N;-1.888333;39.029167;01/12/2025 11:53;1.449;;;;;1.409;;;;;;;;;;;;;;0.899;;;;;;;LA GAVIOTA GASOLINERA 24 HORA;P;dm;L-D: 24H;"L-V: 00:00-08:30 (D), 08:30-19:00 (A), 19:00-23:59 (D); S-D: 24H (D)";2025-12-01;Independiente;Albacete;Castilla - La Mancha;386464.0;193205.0;193259.0;5;9;23;41;57;123;381;142.17982942388113
ALBACETE;ALBACETE;02007;CARRETERA C-M 332 KM. 2,6;D;-1.831611;38.998111;01/12/2025 00:45;1.559;;;1.679;;1.539;1.619;1.439;;;;;;;;;;;;;;;;;;;"INLOCOR S.L. ""CEPSA""";P;dm;L-D: 06:00-23:30;L-D: 06:00-23:30 (A);2025-12-01;Petrolera;Albacete;Castilla - La Mancha;386464.0;193205.0;193259.0;0;5;27;41;57;126;384;137.67168699453072
ALBACETE;ALBACETE;02007;CALLE C/ AUTOVIA C/V AVD. SEXTA, S/N;D;-1.888083;39.029583;02/12/2025 00:00;;;;;;;;;;;;;;;1.279;1.129;;;;;;;;;;;NATURGY ES  GNV ALBACETE;P;dm;L-D: 24H;L-D: 24H (A);2025-12-02;Independiente;Albacete;Castilla - La Mancha;386464.0;193205.0;193259.0;5;9;23;41;57;123;381;142.14446574647113
ALBACETE;ALBACETE;02080;CARRETERA DE LAS PEÑAS KM 0+238 KM. 0,238;I;-1.873194;38.970778;01/12/2025 13:17;1.469;;;;;1.449;;;;;;;;;;;;;;;;;;;;;AREA LOS LLANOS;P;dm;L-D: 07:00-22:00;L-D: 07:00-22:00 (A);2025-12-01;Independiente;Albacete;Castilla - La Mancha;386464.0;193205.0;193259.0;1;3;26;39;56;119;388;139.0883108061208
ALBACETE;ALBACETE;02080;AUTOVIA A-30 KM. 239,4;D;-1.93325;39.059806;03/12/2025 11:00;1.529;;;1.679;;1.489;1.559;;;;;;;;;;;;;;;;;;;; MOEVE;P;OM;L-D: 07:00-23:00;Sin datos;2025-12-03;Petrolera;Albacete;Castilla - La Mancha;386464.0;193205.0;193259.0;1;1;4;29;66;129;379;144.8198185949698
ALBACETE;ALBACETE;02080;AUTOVIA A-30 KM. 239,4;I;-1.933056;39.060528;03/12/2025 14:00;1.519;;;;;1.499;1.565;;;;;;;;;;;;;;;;;;;;MOEVE;P;OM;L-D: 24H;L-D: 24H (A);2025-12-03;Petrolera;Albacete;Castilla - La Mancha;386464.0;193205.0;193259.0;1;1;3;28;66;129;380;144.78023763336358
ALBACETE;ALBACETE;02080;POLIGONO Nº 71, PARCELA 678, PARAJE HONDO DE LA MORENA S/N, S/N;D;-1.823639;38.969361;28/11/2025 07:25;1.539;;;1.649;;1.499;1.589;;;;;;;;;;;;;0.989;;;;;;;CEPSA;P;dm;L-D: 06:30-22:30;Sin datos;2025-11-28;Petrolera;Albacete;Castilla - La Mancha;386464.0;193205.0;193259.0;0;2;15;41;56;123;390;135.363590856209
ALCADOZO;ALCADOZO;02124;CM-3203 km 41,9;I;-1.978917;38.646833;01/12/2025 18:27;1.584;;;;;1.549;1.599;1.279;;;;;;;;;;;;;;;;;;;CEPSA;P;dm;L-D: 07:00-21:30;L-D: 07:00-21:30 (A);2025-12-01;Petrolera;Albacete;Castilla - La Mancha;386464.0;193205.0;193259.0;0;0;0;2;5;91;427;133.04023266314724
ALCALÁ DEL JÚCAR;ALCALA DEL JUCAR;02210;CARRETERA CM-3201 47,1 KM. 47,1;D;-1.433222;39.203167;02/12/2025 13:19;1.469;;;;;1.439;;;;;;;;;;;;;;;;;;;;;EL JUCAR;P;dm;L-D: 08:00-20:00;Sin datos;2025-12-02;Independiente;Albacete;Castilla - La Mancha;386464.0;193205.0;193259.0;0;0;0;2;14;135;822;98.95432872399454
ALCARAZ;ALCARAZ;02300;CR N-322 276,5;D;-2.492222;38.673111;25/11/2025 15:11;1.569;;;1.699;;1.519;1.589;;;;;;;;;;;;;;;;;;;;REPSOL;P;dm;L-D: 07:00-22:00;L-D: 07:00-22:00 (A);2025-11-25;Petrolera;Albacete;Castilla - La Mancha;386464.0;193205.0;193259.0;0;0;0;0;7;44;402;176.9903220903049
ALCARAZ;JARDIN (EL);02330;CARRETERA 322 KM. 302;I;-2.327639;38.808528;03/12/2025 00:00;1.479;;1.529;;;1.459;1.509;;;;;;;;;;;;;;;;;;;;REPSOL;P;OM;L-V: 07:00-17:00;L-V: 07:00-17:00 (A);2025-12-03;Petrolera;Albacete;Castilla - La Mancha;386464.0;193205.0;193259.0;0;0;0;0;5;83;425;167.27109325009735
ALMANSA;ALMANSA;02640;AVENIDA AYORA CON AVENIDA ADOLFO SUAREZ, S/N;D;-1.100028;38.878667;01/12/2025 04:15;1.379;;;;;1.349;;;;;;;;;;;;;;;;;;;;;PLENERGY;P;dm;L-D: 24H;L-D: 24H (D);2025-12-01;Descuento;Albacete;Castilla - La Mancha;386464.0;193205.0;193259.0;3;4;6;8;27;119;1288;81.11806883589956
ALMANSA;ALMANSA;02640;AUTOVIA A-31 KM. 140;D;-1.17575;38.875028;02/12/2025 15:00;1.519;;;1.659;;1.509;1.589;;;;;;;;;;;;;;;;;;;;SHELL;P;OM;L-D: 07:00-23:00;L-D: 07:00-23:00 (A);2025-12-02;Petrolera;Albacete;Castilla - La Mancha;386464.0;193205.0;193259.0;0;0;1;7;18;105;1269;85.12398311848806
ALMANSA;ALMANSA;02640;CL AVDA. DE AYORA, S.N. A;D;-1.100528;38.874583;03/12/2025 00:00;1.529;;;1.639;;1.509;1.589;;;;;;;0.949;;;;;;;;;;;;;REPSOL;P;OM;L-D: 06:00-22:00;L-D: 06:00-22:00 (A);2025-12-03;Petrolera;Albacete;Castilla - La Mancha;386464.0;193205.0;193259.0;4;4;6;8;27;119;1290;80.794595616718
ALMANSA;ALMANSA;02640;AUTOVIA A-31 KM. 143,350;I;-1.143722;38.878278;03/12/2025 09:56;1.499;;;1.569;;1.509;1.609;;;;;;;;;;;;;0.899;;;;;;;MOEVE;P;dm;L-D: 06:00-22:00;L-D: 06:00-22:00 (A);2025-12-03;Petrolera;Albacete;Castilla - La Mancha;386464.0;193205.0;193259.0;0;0;6;7;26;110;1285;83.53218128819282
ALMANSA;ALMANSA;02640;AVENIDA CIRCUNVALACION, 9;N;-1.098889;38.879167;03/12/2025 13:44;1.379;;1.399;;;1.349;1.369;;;;;;;;;;;;;;;;;;;;BALLENOIL;P;OM;L-D: 24H;L-D: 24H (D);2025-12-03;Descuento;Albacete;Castilla - La Mancha;386464.0;193205.0;193259.0;3;4;6;8;27;120;1287;81.0987599814225
ALMANSA;ALMANSA;02640;AVENIDA INFANTE DON JUAN MANUEL, 8;D;-1.102944;38.874556;01/12/2025 10:46;1.389;;;;;1.349;;;;;;;;;;;;;;0.899;;;;;;;QUALITY ALMANSA;P;dm;L-D: 24H;Sin datos;2025-12-01;Independiente;Albacete;Castilla - La Mancha;386464.0;193205.0;193259.0;4;4;6;8;27;119;1289;80.9255038486937
ALMANSA;ALMANSA;02640;AVENIDA MADRID, 11;N;-1.108;38.871556;03/12/2025 13:44;1.379;;1.399;;;1.349;1.369;;;;;;;;;;;;;;;;;;;;BALLENOIL;P;OM;L-D: 24H;L-D: 24H (D);2025-12-03;Descuento;Albacete;Castilla - La Mancha;386464.0;193205.0;193259.0;2;4;6;8;27;118;1296;80.94959712258446
ALMANSA;ALMANSA;02640;AVENIDA CIRCUNVALACION, 26;N;-1.08475;38.859944;03/12/2025 09:55;1.499;;;;;1.509;1.609;;;;;;;;;;;;;0.899;;;;;;;MOEVE;P;dm;L-D: 06:00-22:00;L-D: 06:00-22:00 (A);2025-12-03;Petrolera;Albacete;Castilla - La Mancha;386464.0;193205.0;193259.0;0;0;5;8;27;132;1307;78.66967355851624
ALMANSA;ALMANSA;02640;CARRETERA N-430 BADAJOZ A VALENCIA KM. 594;D;-1.027694;38.850278;01/12/2025 02:03;1.399;;;;;1.359;;1.109;;;;;;;;;;;;0.649;;;;;;;GASOLINERA LOW COST PENADES;P;dm;L-D: 24H;L-D: 24H (P);2025-12-01;Independiente;Albacete;Castilla - La Mancha;386464.0;193205.0;193259.0;0;0;0;6;27;158;1333;74.76512131772957
ALPERA;ALPERA;02690;BONETE, S/Nº;N;-1.236552;38.958875;01/12/2025 10:19;1.376;;;;;1.351;;0.958;;;;;;;;;;;;;;;;;;;COOPERATIVA SANTA CRUZ DE ALPERA;P;dm;L-D: 24H;L-D: 24H (A);2025-12-01;Independiente;Albacete;Castilla - La Mancha;386464.0;193205.0;193259.0;0;0;0;0;20;83;1104;94.7632613850464
BALAZOTE;BALAZOTE;02320;N-322 km 326,2;D;-2.150639;38.878028;01/12/2025 12:21;1.556;;;;;1.512;;1.12;;;;;;;;;;;;;;;;;;;E.S. BALAZOTE S.L.;P;dm;L-D: 06:00-22:00;L-D: 06:00-22:00 (P);2025-12-01;Independiente;Albacete;Castilla - La Mancha;386464.0;193205.0;193259.0;0;0;0;1;10;91;394;155.71936876762243
BARRAX;BARRAX;02639;CAMINO DE LOS GONZALOS SN;D;-2.192996;39.051236;01/12/2025 11:53;;;;;;1.34;;0.974;;;;;;;;;;;;;;;;;;;COABA;R;dm;L-D: 24H;L-D: 24H (A);2025-12-01;Independiente;Albacete;Castilla - La Mancha;386464.0;193205.0;193259.0;1;1;1;1;20;138;400;166.6278444325947
BARRAX;BARRAX;02639;CALLE ALBACETE, 57;I;-2.195139;39.043139;01/12/2025 12:20;1.556;;;;;1.512;;1.12;;;;;;;;;;;;;;;;;;;E.S. BARRAX S.L.;P;dm;L-D: 06:00-22:00;L-D: 06:00-22:00 (P);2025-12-01;Independiente;Albacete;Castilla - La Mancha;386464.0;193205.0;193259.0;1;1;1;1;20;138;405;167.04575329362402
BONETE;BONETE;02691;CR N-430, 566,3;I;-1.331611;38.876111;03/12/2025 00:00;1.509;;;1.619;;1.479;1.529;;;;;;;;;;;;;;;;;;;;REPSOL;P;OM;L-D: 06:00-22:00;L-D: 06:00-22:00 (A);2025-12-03;Petrolera;Albacete;Castilla - La Mancha;386464.0;193205.0;193259.0;1;1;1;2;19;117;982;94.91424417350889
BONETE;BONETE;02691;AUTOVIA A-31 KM. 126;D;-1.3315;38.875861;03/12/2025 00:00;1.509;;;1.619;;1.479;1.529;;;;;;;;;;;;;;;;;;;;REPSOL;P;OM;L-D: 06:00-22:00;L-D: 06:00-22:00 (A);2025-12-03;Petrolera;Albacete;Castilla - La Mancha;386464.0;193205.0;193259.0;1;1;1;2;19;117;983;94.88873919956303
BONILLO (EL);BONILLO (EL);02610;CALLE CARRETERA MUNERA, 2;D;-2.535056;38.953361;03/12/2025 00:00;1.479;;;1.589;;1.459;1.559;1.134;;;;;;;;;;;;;;;;;;;REPSOL;P;OM;S-D: 07:00-15:00;S-D: 07:00-15:00 (A);2025-12-03;Petrolera;Albacete;Castilla - La Mancha;386464.0;193205.0;193259.0;0;0;0;0;5;83;463;175.61316153350614
CASAS DE JUAN NÚÑEZ;CASAS DE JUAN NUÑEZ;02151;AVDA. ALBACETE, 33;D;-1.560857;39.100792;01/12/2025 08:47;1.559;;;;;1.499;;0.95;;;;;;;;;;;;;;;;;;;GASOLINERAS DEL REY;P;dm;L-D: 07:00-23:00;L-D: 07:00-23:00 (A);2025-12-01;Independiente;Albacete;Castilla - La Mancha;386464.0;193205.0;193259.0;0;0;1;1;21;128;556;112.85728165724105
CASAS DE VES;CASAS DE VES;02212;CARRETERA CASAS IBAÑEZ KM. 13,8;D;-1.332194;39.255139;24/11/2025 11:35;;;;;;;;0.96;;;;;;;;;;;;;;;;;;;COOPERATIVA;R;dm;L-V: 08:00-13:30 y 15:00-18:00;L-V: 08:00-13:30 (A), 15:00-18:00 (A);2025-11-24;Independiente;Albacete;Castilla - La Mancha;386464.0;193205.0;193259.0;0;0;0;0;10;87;891;89.10381825124655
CASAS-IBÁÑEZ;CASAS-IBAÑEZ;02200;CARRETERA ALBACETE KM. 94;I;-1.477806;39.283944;01/12/2025 21:00;1.559;;;1.679;;1.489;1.549;1.249;;;;;;;;;;;;;;;;;;;MOEVE;P;dm;L-D: 07:00-21:00;L-D: 07:00-21:00 (A);2025-12-01;Petrolera;Albacete;Castilla - La Mancha;386464.0;193205.0;193259.0;1;1;1;4;22;138;767;100.76553772036408
CASAS-IBÁÑEZ;CASAS-IBAÑEZ;02200;AVDA. DEL VINO, 10;D;-1.474111;39.291389;01/12/2025 14:19;;;;;;;;1.1;;;;;;;;;;;;;;;;;;;NTRA SRA DE LA CABEZA;R;dm;L-D: 24H;L-D: 24H (A);2025-12-01;Independiente;Albacete;Castilla - La Mancha;386464.0;193205.0;193259.0;1;1;1;2;22;137;777;100.31509935474779
CAUDETE;CAUDETE;02660;CR N-344 DIRC.VALENCIA, KM.  118.3;N;-0.943;38.727472;30/11/2025 11:24;1.569;;;1.709;;1.499;1.599;;;;;;;;;;;;;;;;;;;;BP PARGA I PETROL BAS BEL;P;dm;L-D: 06:00-22:00;L-D: 06:00-22:00 (A);2025-11-30;Petrolera;Albacete;Castilla - La Mancha;386464.0;193205.0;193259.0;1;1;5;7;50;206;1340;59.489581642689465
CAUDETE;CAUDETE;02660;AUTOVIA A-31 KM. 167,50;I;-0.955833;38.756417;03/12/2025 00:00;1.509;;;1.619;;1.479;1.529;1.164;;;;;;;;;;;;;;;;;;;REPSOL;P;OM;L-D: 06:00-23:00;L-D: 06:00-23:00 (A);2025-12-03;Petrolera;Albacete;Castilla - La Mancha;386464.0;193205.0;193259.0;0;0;2;9;45;205;1360;62.696698985385915
CAUDETE;CAUDETE;02660;CARRETERA D12 ESTACION KM. 1;D;-0.973861;38.71075;01/12/2025 13:50;;;;;;;;;;;;;;;;1.099;;;;;;;;;;;HAM;P;dm;L-D: 24H;L-D: 24H (D);2025-12-01;Descuento;Albacete;Castilla - La Mancha;386464.0;193205.0;193259.0;2;2;4;6;45;194;1309;59.83374353093033
CAUDETE;CAUDETE;02660;AVENIDA VALENCIA DE, 16;N;-0.982111;38.708944;22/11/2025 21:39;1.569;;;1.719;;1.459;1.549;;;;;;;;;;;;;;;;;;;;GALP;P;dm;L-D: 06:00-22:00;Sin datos;2025-11-22;Petrolera;Albacete;Castilla - La Mancha;386464.0;193205.0;193259.0;2;2;4;6;46;194;1299;60.171876049661805
CAUDETE;CAUDETE;02660;CARRETERA D-12 ESTACION KM. 32;D;-0.971639;38.711694;01/12/2025 09:47;1.479;;;;;1.409;;1.079;;;;;;;;;;;;;;;;;;;VILA Y FAYOS ;P;dm;L-D: 24H;L-D: 24H (A);2025-12-01;Independiente;Albacete;Castilla - La Mancha;386464.0;193205.0;193259.0;2;2;4;6;45;195;1313;59.781624039778904
CENIZATE;CENIZATE;02247;CALLE VIRGEN DE LAS NIEVES, 17;D;-1.664167;39.301;01/12/2025 08:56;1.372;;;;;1.379;;0.934;;;;;;;;;;;;;;;;;;;VIRGEN DE LAS NIEVES;P;dm;L-D: 24H;L-D: 24H (A);2025-12-01;Independiente;Albacete;Castilla - La Mancha;386464.0;193205.0;193259.0;0;0;0;7;35;140;446;116.33786431237047
CHINCHILLA DE MONTE-ARAGÓN;CHINCHILLA DE MONTE-ARAGO;02520;Ctra. AB-430 KM 530,3;I;-1.726278;38.915972;03/12/2025 00:00;1.529;;;1.639;;1.489;1.589;;;;;;;;;;;;;;;;;;;;REPSOL;P;OM;L: 06:00-22:00;L: 06:00-22:00 (A);2025-12-03;Petrolera;Albacete;Castilla - La Mancha;386464.0;193205.0;193259.0;0;0;2;3;55;120;442;125.07539106197746
CHINCHILLA DE MONTE-ARAGÓN;CHINCHILLA DE MONTE-ARAGO;02520;AUTOVIA A-31 KM. 86;D;-1.758;38.937583;03/12/2025 00:00;1.519;;;1.649;;1.479;;;;;;;;0.959;;;;;;;1.569;;;;;;REPSOL;P;OM;L-D: 06:00-22:00;Sin datos;2025-12-03;Petrolera;Albacete;Castilla - La Mancha;386464.0;193205.0;193259.0;1;1;2;11;57;128;422;128.67778515851617
CHINCHILLA DE MONTE-ARAGÓN;CHINCHILLA DE MONTE-ARAGO;02520;AUTOVIA A-31 KM. 86;I;-1.757611;38.938611;03/12/2025 00:00;1.519;;;;;1.479;1.529;;;;;;;;;;;;;;;;;;;;REPSOL;P;OM;L-D: 06:00-22:00;Sin datos;2025-12-03;Petrolera;Albacete;Castilla - La Mancha;386464.0;193205.0;193259.0;1;1;2;11;57;128;422;128.7104856278262
CHINCHILLA DE MONTE-ARAGÓN;POZO BUENO;02510;CL AVENIDA GENERALISIMO 107 (N-301 km 276);I;-1.731861;38.803389;03/12/2025 00:00;1.509;;1.569;;;1.509;;;;;;;;;;;;;;;1.599;;;;;;REPSOL;P;OM;L-D: 06:00-22:00;L-D: 06:00-22:00 (A);2025-12-03;Petrolera;Albacete;Castilla - La Mancha;386464.0;193205.0;193259.0;1;2;2;2;35;108;497;119.33510590577784
CHINCHILLA DE MONTE-ARAGÓN;VILLAR DE CHINCHILLA;02695;AUTOVIA A31 KM. 111;N;-1.502806;38.898306;01/12/2025 06:00;1.559;;;;;1.529;1.629;;;;;;;;;;;;;1.199;;;;;;;CEPSA;P;dm;"L-V: 06:00-22:00; S-D: 07:00-22:00";Sin datos;2025-12-01;Petrolera;Albacete;Castilla - La Mancha;386464.0;193205.0;193259.0;0;0;0;3;18;132;662;108.00105102750345
ELCHE DE LA SIERRA;ELCHE DE LA SIERRA;02430;POLIGONO EL CAMPILLO A, 2;D;-2.017917;38.460694;03/12/2025 09:15;1.42;;;;;1.439;;;;;;;;;;;;;;;;;;;;;DLP;P;dm;"L-V: 08:00-21:00; S: 08:00-14:00";"L-V: 08:00-21:00 (P); S: 08:00-14:00 (P)";2025-12-03;Independiente;Albacete;Castilla - La Mancha;386464.0;193205.0;193259.0;0;0;1;1;5;62;532;132.33474769077526
ELCHE DE LA SIERRA;ELCHE DE LA SIERRA;02430;CL BOLEA, 36 (CM-412 km 235,65);D;-2.044778;38.451306;03/12/2025 00:00;1.479;;;1.589;;1.499;;1.164;;;;;;;;;;;;;1.589;;;;;;CAMPSA;P;OM;L: 06:00-22:00;L: 06:00-22:00 (A);2025-12-03;Petrolera;Albacete;Castilla - La Mancha;386464.0;193205.0;193259.0;0;0;1;1;4;61;532;134.54281087869805
FUENTE-ÁLAMO;FUENTE-ALAMO;02651;LA HIGUERA, 000;D;-1.431579;38.695348;01/12/2025 10:49;;;;;;1.32;;0.92;;;;;;;;;;;;;;;;;;;SAN DIONISIO;R;dm;L-D: 24H;L-D: 24H (A);2025-12-01;Independiente;Albacete;Castilla - La Mancha;386464.0;193205.0;193259.0;1;1;1;2;17;108;907;90.68402727612984
FUENTE-ÁLAMO;FUENTE-ALAMO;02651;AVDA. DOCTOR PEREZ GIL, 25;N;-1.433306;38.689833;01/12/2025 19:53;1.659;;;1.82;;1.499;;1.099;;;;;;;;;;;;;;;;;;;Nº 7374;P;dm;L: 07:00-21:00;Sin datos;2025-12-01;Independiente;Albacete;Castilla - La Mancha;386464.0;193205.0;193259.0;1;1;1;2;17;107;904;90.53363746304423
FUENTEALBILLA;FUENTEALBILLA;02260;N-322 (CORDOBA-VALENCIA) km 399;I;-1.548639;39.269972;24/11/2025 15:12;1.449;;;;;1.419;;1.009;;;;;;;;;;;;;;;;;;;ES SAN ANTONIOABAD. FUENTEALBILLA;P;dm;L-D: 07:00-20:00;L-D: 07:00-20:00 (A);2025-11-24;Independiente;Albacete;Castilla - La Mancha;386464.0;193205.0;193259.0;0;0;0;4;25;140;659;107.03874682595296
GINETA (LA);GINETA (LA);02110;CR N-301, 231,8;D;-1.990194;39.107667;03/12/2025 00:00;1.489;;;1.609;;1.469;1.519;;;;;;;;;;;;;;;;;;;;REPSOL;P;OM;L-D: 07:00-21:00;L-D: 07:00-21:00 (A);2025-12-03;Petrolera;Albacete;Castilla - La Mancha;386464.0;193205.0;193259.0;0;0;1;4;66;140;374;148.09627856126644
GINETA (LA);GINETA (LA);02110;CR A-31, 235;I;-1.963944;39.086278;03/12/2025 14:00;1.519;;1.569;1.629;;1.479;;;;;;;;;;;;;;;1.569;;;;;;REPSOL;P;OM;L-D: 06:00-22:00;L-D: 06:00-22:00 (A);2025-12-03;Petrolera;Albacete;Castilla - La Mancha;386464.0;193205.0;193259.0;0;0;3;10;70;133;383;146.5311244539411
GOLOSALVO;GOLOSALVO;02253;CARRETERA NACIONAL 322 KM. 390;D;-1.635111;39.238111;02/12/2025 14:26;1.519;;;1.665;;1.499;1.575;;;;;;;;;;;;;0.959;;;;;;;MOEVE;P;dm;L: 06:00-22:00;L: 06:00-22:00 (A);2025-12-02;Petrolera;Albacete;Castilla - La Mancha;386464.0;193205.0;193259.0;0;0;0;5;29;141;477;115.00983145419501
HELLÍN;HELLIN;02400;AVENIDA LIBERTAD, 111;D;-1.700417;38.517306;03/12/2025 09:27;1.379;;;;;1.379;;;;;;;;;;;;;;;;;;;;;PLENERGY;P;dm;L-D: 24H;L-D: 24H (A);2025-12-03;Descuento;Albacete;Castilla - La Mancha;386464.0;193205.0;193259.0;2;4;8;13;17;86;716;106.06564057714456
HELLÍN;HELLIN;02400;CARRETERA JAEN KM. 47;D;-1.714556;38.502889;03/12/2025 00:00;1.479;;;1.599;;1.479;;;;;;;;;;;;;;;1.569;;;;;;REPSOL;P;OM;L-D: 07:00-22:30;Sin datos;2025-12-03;Petrolera;Albacete;Castilla - La Mancha;386464.0;193205.0;193259.0;0;1;8;9;17;86;713;106.95047395877957
HELLÍN;HELLIN;02400;CARRETERA MURCIA KM. 33;I;-1.687833;38.506806;03/12/2025 00:00;1.489;;;1.609;;1.479;;;;;;;;;;;;;;;1.569;;;;;;PETRONOR;P;OM;L-D: 06:00-23:00;L: 06:00-23:00 (A);2025-12-03;Petrolera;Albacete;Castilla - La Mancha;386464.0;193205.0;193259.0;1;3;9;11;17;87;728;104.75538340017528
HELLÍN;HELLIN;02400;CARRETERA N-301 KM. 316;I;-1.703056;38.524444;03/12/2025 00:00;1.499;;;1.609;;1.509;;;;;;;;;;;;;;;1.599;;;;;;REPSOL;P;OM;L-D: 06:00-23:00;L-D: 06:00-23:00 (A);2025-12-03;Petrolera;Albacete;Castilla - La Mancha;386464.0;193205.0;193259.0;1;3;8;13;17;85;707;106.45807473297988
HELLÍN;HELLIN;02400;CARRETERA CM 412 KM. 273;D;-1.694889;38.532389;22/11/2025 14:50;1.409;;;;;1.379;;;;;;;;;;;;;;;;;;;;;PETROGAS;P;dm;L-D: 06:30-22:00;L-D: 06:30-22:00 (A);2025-11-22;Independiente;Albacete;Castilla - La Mancha;386464.0;193205.0;193259.0;0;3;7;13;17;88;710;105.95917301946074
HELLÍN;HELLIN;02400;CARRETERA N 301-A KM. S/N;D;-1.677694;38.502528;01/12/2025 11:28;1.389;;;;;1.379;;;;;;;;;;;;;;;;;;;;;GALERA ÁREAS DE SERVICIO;P;dm;L-D: 24H;L-D: 24H (A);2025-12-01;Independiente;Albacete;Castilla - La Mancha;386464.0;193205.0;193259.0;0;2;7;10;17;91;740;103.7961998593533
HELLÍN;HELLIN;02400;POLIGONO SAN RAFAEL 3ª FASE, SN;N;-1.705389;38.545111;03/12/2025 00:00;;;;;;1.507;;;;;;;;;;;;;;1.032;;;;;;;IDS;P;dm;L-D: 24H;L-D: 24H (A);2025-12-03;Descuento;Albacete;Castilla - La Mancha;386464.0;193205.0;193259.0;0;1;6;13;17;81;698;107.17303566495042
HELLÍN;HELLIN;02400;AUTOVIA A-30 KM. 322,5;D;-1.596722;38.46425;01/12/2025 12:02;1.559;;;1.689;;1.519;1.589;;;;;;;;;;;;;1.199;;;;;;;MOEVE;P;dm;L-D: 06:00-22:00;L-D: 06:00-22:00 (A);2025-12-01;Petrolera;Albacete;Castilla - La Mancha;386464.0;193205.0;193259.0;0;0;1;4;26;104;889;96.0857395241161
HELLÍN;HELLIN;02400;CARRETERA TORREUCHEA KM. 1;D;-1.636389;38.495972;01/12/2025 11:26;1.579;;;1.709;;1.559;1.659;;;;;;;1.029;;;;;;;;;;;;;HELLIN GAS S.L.;P;dm;L-D: 24H;L-D: 24H (A);2025-12-01;Independiente;Albacete;Castilla - La Mancha;386464.0;193205.0;193259.0;0;0;3;10;18;94;806;100.128540742282
HELLÍN;HELLIN;02400;MELCHOR  DE MACANAZ, 66;N;-1.696972;38.511222;01/12/2025 13:58;1.499;;;1.629;;1.529;1.629;;;;;;;;;;;;;;;;;;;;BP;P;dm;L: 06:00-23:00;L: 06:00-23:00 (A);2025-12-01;Petrolera;Albacete;Castilla - La Mancha;386464.0;193205.0;193259.0;2;5;8;10;17;86;724;105.63319350996298
HELLÍN;HELLIN;02400;CARRETERA A-30 KM. 328,2;I;-1.571667;38.417306;01/12/2025 06:00;1.553;;;1.676;;1.539;1.617;;;;;;;;;;;;;;;;;;;;CEPSA;P;dm;L-D: 06:00-22:00;L-D: 06:00-22:00 (A);2025-12-01;Petrolera;Albacete;Castilla - La Mancha;386464.0;193205.0;193259.0;0;0;0;1;35;131;932;93.17057886714412
HELLÍN;ISSO;02420;CARRETERA DE HELLIN KM. 104;D;-1.741111;38.491861;03/12/2025 00:00;1.479;;;1.599;;1.469;;1.204;;;;;;;;;;;;;1.559;;;;;;REPSOL;P;OM;L-D: 06:00-23:00;L-D: 06:00-23:00 (A);2025-12-03;Petrolera;Albacete;Castilla - La Mancha;386464.0;193205.0;193259.0;0;0;5;9;17;88;700;108.9964309360862
HIGUERUELA;HIGUERUELA;02694;BALTASAR GONZALEZ SAEZ, 34 - 36;D;-1.444083;38.960944;25/11/2025 17:39;1.372;;;;;1.366;;0.94;;;;;;;;;;;;;;;;;;;NO;R;dm;L-D: 24H;L-D: 24H (D);2025-11-25;Independiente;Albacete;Castilla - La Mancha;386464.0;193205.0;193259.0;0;0;0;1;12;119;667;108.44930799431697
HOYA-GONZALO;HOYA-GONZALO;02696;AUTOVIA A-31 KM. 103,150;D;-1.583389;38.921833;03/12/2025 08:01;1.519;;;1.629;;1.489;1.559;;;;;;;;;;;;;;;;;;;;REPSOL;P;dm;L-D: 07:00-23:00;L-D: 07:00-23:00 (A);2025-12-03;Petrolera;Albacete;Castilla - La Mancha;386464.0;193205.0;193259.0;0;0;0;1;25;124;554;115.17139185063444
LETUR;LETUR;02434;CARRETERA A 45 KM. 39,8;D;-2.111056;38.356556;01/12/2025 19:49;1.517;;;;;1.487;;1.125;;;;;;;;;;;;;;;;;;;E.S. LETUR;P;dm;L-D: 07:30-21:30;Sin datos;2025-12-01;Independiente;Albacete;Castilla - La Mancha;386464.0;193205.0;193259.0;0;0;0;0;4;58;519;139.60878408644353
MADRIGUERAS;MADRIGUERAS;02230;AVENIDA LEVANTE, 15;I;-1.799472;39.233056;03/12/2025 00:00;1.479;;;;;1.459;;1.134;;;;;;;;;;;;;1.549;;;;;;REPSOL;P;OM;L-D: 06:00-22:00;L-D: 06:00-22:00 (A);2025-12-03;Petrolera;Albacete;Castilla - La Mancha;386464.0;193205.0;193259.0;2;2;2;5;45;145;387;129.0226141750239
MADRIGUERAS;MADRIGUERAS;02230;CARRETERA C-3222 KM. 9;D;-1.800611;39.226611;01/12/2025 10:27;1.469;;;;;1.419;;;;;;;;;;;;;;;;;;;;;Q8;P;dm;L-S: 07:00-15:00;L-S: 07:00-15:00 (A);2025-12-01;Descuento;Albacete;Castilla - La Mancha;386464.0;193205.0;193259.0;2;2;2;5;48;145;386;129.2492319401252
MADRIGUERAS;MADRIGUERAS;02230;AVENIDA DE LEVANTE 27;D;-1.794139;39.232528;01/12/2025 10:15;;;;;;1.35;;0.94;;;;;;;;;;;;;;;;;;;SAT VIDEMA;R;dm;L-D: 24H;L-D: 24H (A);2025-12-01;Independiente;Albacete;Castilla - La Mancha;386464.0;193205.0;193259.0;2;2;2;5;45;144;387;128.5812811763556
MAHORA;MAHORA;02240;CAMINO HORTIGOSA, S/N;N;-1.729333;39.209972;01/12/2025 10:27;;;;;;1.4;;0.93;;;;;;;;;;;;;;;;;;;SECADEMA;R;dm;L-D: 24H;L-D: 24H (A);2025-12-01;Independiente;Albacete;Castilla - La Mancha;386464.0;193205.0;193259.0;0;0;0;7;42;141;389;123.58872819131388
MINAYA;MINAYA;02620;CARRERA N-301, 195,2;D;-2.330333;39.276056;01/12/2025 12:01;1.549;;;1.679;;1.499;;1.129;;;;;;;;;;;;1.199;1.599;;;;;;REPSOL;P;dm;L-D: 06:00-22:00;L-D: 06:00-22:00 (P);2025-12-01;Petrolera;Albacete;Castilla - La Mancha;386464.0;193205.0;193259.0;1;1;1;5;44;137;432;153.71363965146543
MINAYA;MINAYA;02620;CARRETERA MADRID-CARTAGENA KM. S/N;D;-2.325056;39.273583;01/12/2025 19:00;;;;;;1.35;;0.98;;;;;;;;;;;;;;;;;;;COOPERATIVA VITIVINICOLA SANTIAGO EL MAYOR;R;dm;L-D: 24H;L-D: 24H (A);2025-12-01;Independiente;Albacete;Castilla - La Mancha;386464.0;193205.0;193259.0;1;1;1;5;43;140;430;154.20523064280897
MONTEALEGRE DEL CASTILLO;MONTEALEGRE DEL CASTILLO;02650;CALLE CAPATAZ SANTIAGO, 91;D;-1.32875;38.789694;01/12/2025 19:46;;;;;;1.319;;0.939;;;;;;;;;;;;;;;;;;;BODEGAS SANTIAGO APOSTOL;R;dm;L-D: 06:30-23:00;L-D: 06:30-23:00 (A);2025-12-01;Independiente;Albacete;Castilla - La Mancha;386464.0;193205.0;193259.0;1;1;1;3;18;108;978;88.69807865621678
MONTEALEGRE DEL CASTILLO;MONTEALEGRE DEL CASTILLO;02650;CALLE CAPATAZ SANTIAGO, 23;I;-1.33025;38.785917;02/12/2025 09:55;1.529;;;;;1.509;;;;;;;;;;;;;;;;;;;;;LOS CORRALES;P;dm;L-D: 07:00-21:00;L-D: 07:00-21:00 (A);2025-12-02;Independiente;Albacete;Castilla - La Mancha;386464.0;193205.0;193259.0;1;1;1;1;19;108;973;88.55383906363588
MOTILLEJA;MOTILLEJA;02200;MEDIO DÍA 28;N;-1.788246;39.17907;24/11/2025 12:51;;;;;;;;0.95;;;;;;;;;;;;;;;;;;;SAT MOTILLEJA;R;dm;L-D: 24H;L-D: 24H (A);2025-11-24;Independiente;Albacete;Castilla - La Mancha;386464.0;193205.0;193259.0;0;0;0;4;64;144;373;129.28796486208913
MUNERA;MUNERA;02612;CALLE POZO (EL), 106;D;-2.485028;39.043806;01/12/2025 00:00;1.449;;;;;1.419;1.469;;;;;;;;;;;;;0.899;;;;;;;INPEALSA;P;dm;L-D: 06:30-22:30;L-D: 06:30-22:30 (P);2025-12-01;Independiente;Albacete;Castilla - La Mancha;386464.0;193205.0;193259.0;1;1;1;1;3;97;468;168.5221274231911
MUNERA;MUNERA;02612;CALLE COOPERATIVAS, 4;N;-2.480694;39.046139;01/12/2025 12:08;1.469;;;;;1.459;;1.0;;;;;;;;;;;;;;;;;;;OLEOVINICOLA CAMPOS DE MUNERA S. COOP. DE C-LM;R;dm;L-D: 24H;L-D: 24H (D);2025-12-01;Independiente;Albacete;Castilla - La Mancha;386464.0;193205.0;193259.0;1;1;1;1;5;96;468;168.4674297025159
NAVAS DE JORQUERA;NAVAS DE JORQUERA;02246;CTRA DE LEDAÑA S/N km S/N;N;-1.719778;39.281778;24/11/2025 10:01;;;;;;1.348;;0.908;;;;;;;;;;;;;;;;;;;COOP SAN GREGORIO;R;dm;L-D: 24H;L-D: 24H (A);2025-11-24;Independiente;Albacete;Castilla - La Mancha;386464.0;193205.0;193259.0;0;0;0;8;32;141;398;121.37342220417823
NERPIO;NERPIO;02530;CR AB-702, 45,6;D;-2.293444;38.151167;03/12/2025 00:00;1.479;;;1.589;;1.459;;1.134;;;;;;;;;;;;;;;;;;;CAMPSA;P;OM;L-D: 07:00-21:00;L-D: 07:00-21:00 (A);2025-12-03;Petrolera;Albacete;Castilla - La Mancha;386464.0;193205.0;193259.0;0;0;0;0;4;46;439;147.33466860073713
ONTUR;ONTUR;02652;CRTA.CM km KM297,5;I;-1.497667;38.622944;03/12/2025 00:00;1.479;;1.549;;;1.459;;1.204;;;;;;;;;;;;;1.549;;;;;;REPSOL ;P;OM;L-D: 07:00-21:00;L-D: 07:00-21:00 (A);2025-12-03;Petrolera;Albacete;Castilla - La Mancha;386464.0;193205.0;193259.0;0;1;1;3;31;96;864;92.54385856861268
ONTUR;ONTUR;02652;CAMINO DE HELLIN S/N;D;-1.508333;38.609556;01/12/2025 14:38;;;;;;1.345;;0.98;;;;;;;;;;;;;;;;;;;ONTALBA S. COOP DE C-LM;P;dm;L-D: 24H;L-D: 24H (A);2025-12-01;Independiente;Albacete;Castilla - La Mancha;386464.0;193205.0;193259.0;0;1;1;1;31;97;867;92.87374961213646
OSSA DE MONTIEL;OSSA DE MONTIEL;02611;CARRETERA N 430 KM. 429;I;-2.7515;38.967167;03/12/2025 00:00;1.489;;1.549;;;1.469;1.539;;;;;;;;;;;;;;;;;;;;REPSOL;P;OM;L-D: 07:30-20:30;Sin datos;2025-12-03;Petrolera;Albacete;Castilla - La Mancha;386464.0;193205.0;193259.0;0;0;0;0;5;85;474;167.0883601011258
PEÑAS DE SAN PEDRO;PEÑAS DE SAN PEDRO;02120;AVENIDA GUARDIA CIVIL, S/N;D;-1.990278;38.724028;01/12/2025 10:25;1.499;;;;;1.469;;;;;;;;;;;;;;;;;;;;;VALERO 24H ENERGIA;P;dm;L-D: 24H;L-D: 24H (A);2025-12-01;Independiente;Albacete;Castilla - La Mancha;386464.0;193205.0;193259.0;0;0;0;2;11;93;412;136.55549562936358
PÉTROLA;PETROLA;02692;CARRETERA FUENTEALAMO KM. 36;I;-1.553694;38.828806;01/12/2025 09:54;1.509;;;;;1.479;;;;;;;;;;;;;;;;;;;;;GASOLEOS TURBULA ;P;dm;L-D: 24H;Sin datos;2025-12-01;Independiente;Albacete;Castilla - La Mancha;386464.0;193205.0;193259.0;0;0;0;1;17;128;692;107.26854271418574
POZO CAÑADA;POZO CAÑADA;02099;CALLE HERNAN CORTES, S/N;N;-1.735917;38.813389;02/12/2025 16:28;;;;;;1.25;;;;;;;;;;;;;;;;;;;;;POZOTRANS;R;dm;L-D: 08:00-20:00;L-D: 08:00-20:00 (D);2025-12-02;Independiente;Albacete;Castilla - La Mancha;386464.0;193205.0;193259.0;1;2;2;2;40;106;496;120.15357954130764
POZO CAÑADA;POZO CAÑADA;02099;CALLE ANTONIO MACHADO, 2;D;-1.736389;38.805278;01/12/2025 10:26;;;;;;1.469;;;;;;;;;;;;;;;;;;;;;E.S. LEDAÑA ;P;dm;"L-V: 07:00-14:00; S: 09:00-14:00";Sin datos;2025-12-01;Independiente;Albacete;Castilla - La Mancha;386464.0;193205.0;193259.0;2;2;2;2;39;106;497;119.78003846565042
POZOHONDO;POZOHONDO;02141;CR CM-313 61,7;I;-1.91075;38.717556;21/11/2025 15:35;1.659;;;;;1.619;;1.339;;;;;;;;;;;;;;;;;;;REPSOL;P;dm;L-D: 07:00-21:00;L-D: 07:00-21:00 (P);2025-11-21;Petrolera;Albacete;Castilla - La Mancha;386464.0;193205.0;193259.0;0;0;0;2;14;91;436;129.81120171030008
POZO-LORENTE;POZO-LORENTE;02154;POLIGONO PARAJE RECIAL, 2;I;-1.512611;39.081278;02/12/2025 11:01;;;;;;1.359;;0.929;;;;;;;;;;;;;;;;;;;SAT SANTA CRUZ DE POZO LORENTE;P;dm;L-D: 24H;L-D: 24H (A);2025-12-02;Independiente;Albacete;Castilla - La Mancha;386464.0;193205.0;193259.0;0;0;1;1;14;119;629;109.70342301394025
POZUELO;POZUELO;02327;CARRETERA M 313 KM. 50;I;-2.098778;38.804722;01/12/2025 00:46;1.559;;;1.679;;1.499;;1.459;;;;;;;;;;;;;;;;;;;INLOCOR S.L.;P;dm;L-D: 07:00-22:00;L-D: 07:00-22:00 (A);2025-12-01;Independiente;Albacete;Castilla - La Mancha;386464.0;193205.0;193259.0;0;0;0;1;10;96;391;148.47755432125368
RIÓPAR;RIOPAR;02450;CARRETERA CM-412 KM. 199,5;I;-2.411444;38.493528;01/12/2025 10:07;1.579;;1.649;;;1.539;1.629;;;;;;;;;;;;;;;;;;;;CEPSA;P;dm;L-D: 08:00-20:00;L-D: 08:00-22:00 (A);2025-12-01;Petrolera;Albacete;Castilla - La Mancha;386464.0;193205.0;193259.0;0;0;0;0;7;37;390;166.7841808315913
ROBLEDO;ROBLEDO;02340;CARRETERA NACIONAL 320 KM. 289;D;-2.450028;38.771194;01/12/2025 19:05;1.399;;;;;1.359;;;;;;;;;;;;;;;;;;;;;CANOIL;P;dm;"L-V: 07:00-21:00; S: 07:00-14:30; D: 07:00-21:00";Sin datos;2025-12-01;Independiente;Albacete;Castilla - La Mancha;386464.0;193205.0;193259.0;0;0;0;0;5;39;423;176.146871729407
RODA (LA);RODA (LA);02630;CR NACIONAL 301 km 210,300;N;-2.176194;39.213667;03/12/2025 13:44;;;;;;1.25;;;;;;;;;;;;;;;;;;;;;RODATRANS;R;dm;L-D: 24H;L-D: 24H (A);2025-12-03;Independiente;Albacete;Castilla - La Mancha;386464.0;193205.0;193259.0;1;4;8;8;31;159;415;161.37170658538784
RODA (LA);RODA (LA);02630;POLIGONO AVENIDA PRIMERA, 17;D;-2.143056;39.19125;01/12/2025 13:50;;;;;;;;;;;;;;;1.149;1.099;;;;;;;;;;;HAM;P;dm;L-D: 24H;L-D: 24H (A);2025-12-01;Descuento;Albacete;Castilla - La Mancha;386464.0;193205.0;193259.0;0;3;7;9;35;156;413;158.97859007329072
RODA (LA);RODA (LA);02630;CARRETERA A-31 KM. 50;D;-2.05125;39.143972;01/12/2025 11:47;1.539;;;1.649;;1.519;1.609;;;;;;;;;;;;;;;;;;;;GALP;P;dm;L-D: 07:00-23:00;L-D: 07:00-23:00 (A);2025-12-01;Petrolera;Albacete;Castilla - La Mancha;386464.0;193205.0;193259.0;0;0;0;3;63;157;386;152.2641021051872
RODA (LA);RODA (LA);02630;CARRETERA MADRID CARTAGENA KM. 209;N;-2.171028;39.212361;01/12/2025 05:30;1.529;;;;;1.509;1.609;;;;;;;;;;;;;;;;;;;;BP CASA JUANITO RESTAURANTE;P;dm;L-D: 06:00-22:00;L-D: 06:00-22:00 (A);2025-12-01;Petrolera;Albacete;Castilla - La Mancha;386464.0;193205.0;193259.0;1;4;8;8;34;157;414;160.95577381288876
RODA (LA);RODA (LA);02630;AUTOVIA A-31 KM. 34,50;I;-2.186083;39.225;01/12/2025 11:47;1.539;;;1.649;;1.519;1.609;;;;;;;;;;;;;;;;;;;;GALP;P;dm;L-D: 07:00-23:00;L-D: 07:00-23:00 (A);2025-12-01;Petrolera;Albacete;Castilla - La Mancha;386464.0;193205.0;193259.0;0;2;7;8;31;161;414;162.01659928471315
RODA (LA);RODA (LA);02630;CARRETERA CM-3114 KM. 0,1;I;-2.156667;39.213722;03/12/2025 00:00;1.519;;;1.629;;1.489;;;;;;;;;;;;;;;1.579;;;;;;REPSOL;P;OM;"L-V: 06:00-10:00; S: 06:00-14:00";"L-V: 06:00-10:00 (A); S: 06:00-14:00 (A)";2025-12-03;Petrolera;Albacete;Castilla - La Mancha;386464.0;193205.0;193259.0;1;6;8;8;35;159;414;159.7103179455509
RODA (LA);RODA (LA);02630;CALLE ALFREDO ATIENZA, 156;D;-2.149;39.201667;03/12/2025 00:00;1.529;;;1.639;;1.499;;;;;;;;;;;;;;;1.589;;;;;;REPSOL;P;OM;L-D: 06:00-22:55;Sin datos;2025-12-03;Petrolera;Albacete;Castilla - La Mancha;386464.0;193205.0;193259.0;2;4;8;8;37;156;412;159.2813248398576
RODA (LA);RODA (LA);02630;CARRETERA AB101 KM. 0,2;N;-2.158028;39.218389;02/12/2025 13:11;1.339;;;;;1.319;;;;;;;;;;;;;;0.6;;;;;;;GASPLAY;P;dm;L-D: 24H;L-D: 24H (A);2025-12-02;Independiente;Albacete;Castilla - La Mancha;386464.0;193205.0;193259.0;1;3;8;8;35;158;413;159.74306431586814
RODA (LA);RODA (LA);02630;ALFREDO ATIENZA, 149-151;D;-2.14775;39.201139;01/12/2025 20:23;1.309;;;;;1.289;;0.909;;;;;;;;;;;;0.55;;;;;;;LA REMEDIADORA;R;dm;L-D: 24H;L-D: 24H (D);2025-12-01;Independiente;Albacete;Castilla - La Mancha;386464.0;193205.0;193259.0;2;4;8;8;37;156;412;159.18520635352152
RODA (LA);RODA (LA);02630;AUTOVIA A-31 KM. 40;D;-2.144639;39.200944;03/12/2025 00:00;1.509;;;1.629;;1.479;1.549;;;;;;;;;;;;;;;;;;;;REPSOL;P;OM;L-D: 06:00-22:00;L-D: 06:00-22:00 (A);2025-12-03;Petrolera;Albacete;Castilla - La Mancha;386464.0;193205.0;193259.0;2;4;8;8;37;156;412;158.92479040562333
SOCOVOS;SOCOVOS;02435;AVENIDA DE LA PAZ, 3;D;-1.981861;38.331361;03/12/2025 00:00;1.519;;;1.699;;1.479;;1.109;;;;;;;;;;;;;;;;;;;NAVARRO Y VALERO, S.L;P;dm;"L-S: 06:00-22:00; D: 06:30-22:00";"L-S: 06:00-22:00 (A); D: 06:30-22:00 (A)";2025-12-03;Independiente;Albacete;Castilla - La Mancha;386464.0;193205.0;193259.0;0;0;0;0;6;58;565;128.29405032986818
TARAZONA DE LA MANCHA;TARAZONA DE LA MANCHA;02100;CL AVENIDA DE LA RODA, 1;I;-1.911389;39.25975;03/12/2025 00:00;1.479;;1.539;;;1.459;;;;;;;;;;;;;;;1.549;;;;;;REPSOL;P;OM;L-D: 07:00-23:00;L-D: 07:00-23:00 (A);2025-12-03;Petrolera;Albacete;Castilla - La Mancha;386464.0;193205.0;193259.0;1;2;2;6;44;147;374;138.04873984959795
TARAZONA DE LA MANCHA;TARAZONA DE LA MANCHA;02100;AVENIDA ALBACETE, 35;D;-1.912194;39.256194;01/12/2025 11:56;1.369;;;;;1.359;;;;;;;;;;;;;;;;;;;;;LA GAVIOTA GASOLINERAS;P;dm;L-D: 24H;L-D: 24H (A);2025-12-01;Independiente;Albacete;Castilla - La Mancha;386464.0;193205.0;193259.0;1;2;2;6;44;147;374;138.17593150445813
TARAZONA DE LA MANCHA;TARAZONA DE LA MANCHA;02100;CARRETERA VILLAGARCIA KM. 0,1;I;-1.908778;39.270556;03/12/2025 10:13;1.34;;;;;1.31;;0.92;;;;;;;;;;;;;;;;;;;COOP. LA UNION AB;R;dm;L-D: 24H;L-D: 24H (A);2025-12-03;Independiente;Albacete;Castilla - La Mancha;386464.0;193205.0;193259.0;0;2;2;7;45;150;371;137.65468631049134
TOBARRA;TOBARRA;02500;AVENIDA GUARDIA CIVIL, 114;D;-1.685417;38.594639;01/12/2025 11:43;1.459;;1.549;;;1.409;1.449;;;;;;;;;;;;;;;;;;;;E.S. TOBARRA;P;dm;L-D: 07:00-22:00;L-D: 07:00-22:00 (A);2025-12-01;Independiente;Albacete;Castilla - La Mancha;386464.0;193205.0;193259.0;2;3;3;9;23;105;688;106.93569982069646
TOBARRA;TOBARRA;02500;AVENIDA GUARDIA CIVIL, 162;D;-1.680833;38.601722;01/12/2025 19:23;1.359;;;;;1.329;;;;;;;;;;;;;;;;;;;;;NTRA. SRA. DE LA ENCARNACION;P;dm;L-D: 06:00-23:00;L-D: 06:00-23:00 (A);2025-12-01;Independiente;Albacete;Castilla - La Mancha;386464.0;193205.0;193259.0;2;3;3;7;23;110;689;106.78393180349113
TOBARRA;TOBARRA;02500;AVENIDA GUARDIA CIVIL, 233;D;-1.680917;38.602278;02/12/2025 13:57;1.559;;;1.679;;1.519;;1.249;;;;;;;;;;;;1.2;1.609;;;;;;REPSOL;P;dm;L-D: 24H;L-D: 24H (A);2025-12-02;Petrolera;Albacete;Castilla - La Mancha;386464.0;193205.0;193259.0;2;3;3;7;23;110;688;106.80916562361283
TOBARRA;TOBARRA;02500;CAMINO CAMINO DEL GUIJARRAL, 0;I;-1.694083;38.603306;21/11/2025 10:52;;;;;;1.35;;1.05;;;;;;;;;;;;;;;;;;;SAN ROQUE DE TOBARRA S. COOP. DE C-LM;P;dm;L-D: 06:00-22:00;L-D: 06:00-22:00 (A);2025-11-21;Independiente;Albacete;Castilla - La Mancha;386464.0;193205.0;193259.0;0;3;3;7;23;110;679;107.93618076561933
VALDEGANGA;VALDEGANGA;02150;CALLE SANTA CRUZ, 16;D;-1.680944;39.137222;01/12/2025 17:51;1.462;;;;;1.425;;0.998;;;;;;;;;;;;;;;;;;;NO HAY;P;dm;L-D: 24H;L-D: 24H (A);2025-12-01;Independiente;Albacete;Castilla - La Mancha;386464.0;193205.0;193259.0;0;0;0;1;62;135;415;121.49589169981398
VILLALGORDO DEL JÚCAR;VILLALGORDO DEL JUCAR;02636;CALLE DEL VINO, 10;N;-2.059556;39.2935;01/12/2025 10:38;;;;;;;;0.965;;;;;;;;;;;;;;;;;;;SAN ISIDRO;R;dm;L-D: 24H;L-D: 24H (D);2025-12-01;Independiente;Albacete;Castilla - La Mancha;386464.0;193205.0;193259.0;0;1;1;3;41;167;390;150.2120538940126
VILLALGORDO DEL JÚCAR;VILLALGORDO DEL JUCAR;02636;CARRETERA CM-3114 KM. 12,7;I;-2.067639;39.302389;03/12/2025 08:51;1.459;;;;;1.419;;;;;;;;;;;;;;;;;;;;;E.S EL GORRION;P;dm;L-D: 07:30-21:30;Sin datos;2025-12-03;Independiente;Albacete;Castilla - La Mancha;386464.0;193205.0;193259.0;0;1;1;6;40;167;395;150.79657898105833
VILLAMALEA;VILLAMALEA;02270;CARRETERA CM-3201 KM. 22,70;D;-1.592778;39.366861;03/12/2025 00:00;1.479;;;1.589;;1.479;1.579;1.204;;;;;;;;;;;;;;;;;;;REPSOL;P;OM;"L-S: 07:00-21:00; D: 07:00-14:00";"L-S: 07:00-21:00 (P); D: 07:00-14:00 (P)";2025-12-03;Petrolera;Albacete;Castilla - La Mancha;386464.0;193205.0;193259.0;1;1;3;5;33;132;561;109.47785649133057
VILLAMALEA;VILLAMALEA;02270;CARRETERA CENIZATE KM. 1,5;D;-1.613194;39.35025;02/12/2025 20:14;1.361;;;;;1.309;;;;;;;;;;;;;;0.509;;;;;;;CHAMPINTER;P;dm;L-D: 00:00-23:59;Sin datos;2025-12-02;Descuento;Albacete;Castilla - La Mancha;386464.0;193205.0;193259.0;0;0;2;6;34;144;526;111.37593369790079
VILLAMALEA;VILLAMALEA;02270;CALLE VALENCIA, 41;I;-1.59325;39.367333;01/12/2025 10:47;;;;;;1.33;;0.928;;;;;;;;;;;;;;;;;;;BODEGAS SAAC;P;dm;L-D: 24H;L-D: 24H (A);2025-12-01;Independiente;Albacete;Castilla - La Mancha;386464.0;193205.0;193259.0;1;1;3;5;33;132;559;109.51452963879274
VILLAPALACIOS;VILLAPALACIOS;02350;CARRETERA DE ALBACETE, 14 KM. 0;D;-2.630167;38.575556;01/12/2025 15:20;1.354;;;;;1.352;;0.958;;;;;;;;;;;;;;;;;;;SIERRA DE ALCARAZ;R;dm;L: 24H;L: 24H (D);2025-12-01;Independiente;Albacete;Castilla - La Mancha;386464.0;193205.0;193259.0;1;1;1;1;11;44;414;186.82217687815594
VILLAPALACIOS;VILLAPALACIOS;02350;CR N-322, 258,8;D;-2.626222;38.581722;24/11/2025 11:32;1.559;;;1.829;;1.499;1.569;1.129;;;;;;;;;;;;;;;;;;;REPSOL;P;dm;L-D: 07:00-21:00;L-D: 07:00-21:00 (A);2025-11-24;Petrolera;Albacete;Castilla - La Mancha;386464.0;193205.0;193259.0;1;1;1;1;11;44;413;186.58386033677368
VILLARROBLEDO;VILLARROBLEDO;02600;CALLE GENERAL MARTI, 2;D;-2.596944;39.266417;01/12/2025 04:15;1.379;;;;;1.279;;;;;;;;;;;;;;;;;;;;;PLENERGY;P;dm;L-D: 24H;L-D: 24H (D);2025-12-01;Descuento;Albacete;Castilla - La Mancha;386464.0;193205.0;193259.0;3;10;14;14;42;127;489;142.1563516378134
VILLARROBLEDO;VILLARROBLEDO;02600;CALLE DOS DE MAYO, 167;I;-2.602028;39.278222;18/11/2025 20:43;1.499;;1.539;;;1.499;1.599;1.189;;;;;;;;;;;;;;;;;;;REPSOL;P;dm;L-D: 06:00-00:00;L-D: 06:00-00:00 (A);2025-11-18;Petrolera;Albacete;Castilla - La Mancha;386464.0;193205.0;193259.0;3;10;14;14;42;131;491;140.7964888165858
VILLARROBLEDO;VILLARROBLEDO;02600;CALLE NOBEL, 64;N;-2.583361;39.283917;01/12/2025 10:46;1.409;;;;;1.329;1.369;;;;;;;;;;;;;0.699;;;;;;;COMBUSTIBLES DISPROSIO S.L.;P;dm;L-S: 08:00-20:00;Sin datos;2025-12-01;Independiente;Albacete;Castilla - La Mancha;386464.0;193205.0;193259.0;3;9;14;14;42;129;489;141.03594205234256
VILLARROBLEDO;VILLARROBLEDO;02600;AUTOVIA A-43 KM. 129;D;-2.586778;39.258778;01/12/2025 14:05;1.559;;;1.669;;1.509;;;;;;;;;;;;;;;1.599;;;;;;REPSOL;P;dm;L-D: 24H;L-D: 24H (A);2025-12-01;Petrolera;Albacete;Castilla - La Mancha;386464.0;193205.0;193259.0;0;4;14;14;42;127;489;143.32420276533963
VILLARROBLEDO;VILLARROBLEDO;02600;CARRETERA OSSA DE MONTIEL KM. 21;I;-2.613778;39.257528;03/12/2025 00:00;1.479;;;1.589;;1.459;;1.174;;;;;;;;;;;;;1.549;;;;;;REPSOL;P;OM;"L-S: 06:00-22:00; D: 06:00-15:00";"L-S: 06:00-22:00 (P); D: 06:00-15:00 (P)";2025-12-03;Petrolera;Albacete;Castilla - La Mancha;386464.0;193205.0;193259.0;0;3;13;14;41;127;496;142.32775629661947
VILLARROBLEDO;VILLARROBLEDO;02600;CARRETERA NACIONAL 310 KM. 137,7;I;-2.567139;39.293722;03/12/2025 00:00;1.479;;;1.589;;1.459;;;;;;;;;;;;;;;1.549;;;;;;REPSOL;P;OM;L-S: 07:00-22:00;L-S: 07:00-22:00 (A);2025-12-03;Petrolera;Albacete;Castilla - La Mancha;386464.0;193205.0;193259.0;0;3;13;16;42;124;483;140.79512498396772
VILLARROBLEDO;VILLARROBLEDO;02600;AVENIDA REYES CATÓLICOS (APARCAMIENTO DEL CARREFOUR), S/N;N;-2.579639;39.285722;03/12/2025 10:45;1.469;;;1.549;;1.389;1.429;;;;;;;;;;;;;;;;;;;;CARREFOUR;P;dm;L-S: 08:00-22:00;L-S: 08:00-22:00 (A);2025-12-03;Supermercado;Albacete;Castilla - La Mancha;386464.0;193205.0;193259.0;2;7;14;14;42;129;488;141.02162433400443
VILLARROBLEDO;VILLARROBLEDO;02600;CALLE FERNANDO ZEPPELIN, 13;D;-2.587083;39.268472;01/12/2025 12:16;;;;;;;;;;;;;;;;1.109;;;;;;;;;;;MOLGAS;P;dm;L-D: 00:00-23:59;L-D: 24H (D);2025-12-01;Descuento;Albacete;Castilla - La Mancha;386464.0;193205.0;193259.0;2;10;14;14;42;128;489;142.3710511853478
VILLARROBLEDO;VILLARROBLEDO;02600;AVENIDA REYES CATOLICOS, 150;D;-2.590194;39.278333;01/12/2025 14:15;;;;;;1.539;;;;;;;;;;;;;;1.2;;;;;;;PAÑALON;P;dm;L-D: 24H;L-D: 24H (P);2025-12-01;Independiente;Albacete;Castilla - La Mancha;386464.0;193205.0;193259.0;5;9;14;14;42;130;489;141.28448274822662
VILLARROBLEDO;VILLARROBLEDO;02600;CARRETERA N-310 KM. 120,5;D;-2.713722;39.198;03/12/2025 09:57;1.539;;;1.675;;1.509;1.609;;;;;;;;;;;;;0.899;;;;;;;MOEVE;P;dm;"L-V: 07:00-21:00; D: 14:00-21:00";"L-V: 07:00-21:00 (A); D: 14:00-21:00 (A)";2025-12-03;Petrolera;Albacete;Castilla - La Mancha;386464.0;193205.0;193259.0;1;1;1;1;28;124;496;144.45929654284382
VILLARROBLEDO;VILLARROBLEDO;02600;AVENIDA REYES CATOLICOS, 138;D;-2.591111;39.276917;01/12/2025 04:15;1.379;;;;;1.279;;;;;;;;;;;;;;;;;;;;;PLENERGY;P;dm;L-D: 24H;Sin datos;2025-12-01;Descuento;Albacete;Castilla - La Mancha;386464.0;193205.0;193259.0;5;10;14;14;42;130;488;141.3827418220342
VILLARROBLEDO;VILLARROBLEDO;02600;AVENIDA REYES CATOLICOS, 26;D;-2.599417;39.261472;03/12/2025 14:00;1.517;;;;;1.487;1.547;;;;;;;;;;;;;;;;;;;;CEPSA;P;OM;"L-V: 07:00-21:00; S: 08:00-13:00";"L-V: 07:00-21:00 (A); S: 08:00-13:00 (A)";2025-12-03;Petrolera;Albacete;Castilla - La Mancha;386464.0;193205.0;193259.0;1;9;14;14;41;126;494;142.53450545786404
VILLARROBLEDO;VILLARROBLEDO;02600;AVENIDA REYES CATOLICOS, 133;D;-2.591722;39.277056;03/12/2025 00:00;1.499;;;1.649;;1.489;1.589;;;;;;;;;;;;;0.99;;;;;;;BP VILLARROBLEDO;P;OM;L-D: 06:00-22:00;L-D: 06:00-22:00 (P);2025-12-03;Petrolera;Albacete;Castilla - La Mancha;386464.0;193205.0;193259.0;5;10;14;14;42;130;488;141.34343925622647
VILLARROBLEDO;VILLARROBLEDO;02600;AUTOVIA A-43 KM. 390;I;-2.708528;39.205194;03/12/2025 14:00;1.555;;1.605;;;1.505;1.599;;;;;;;;;;;;;;;;;;;;MOEVE;P;OM;L-D: 06:00-23:59;L-D: 06:00-23:59 (A);2025-12-03;Petrolera;Albacete;Castilla - La Mancha;386464.0;193205.0;193259.0;1;1;1;1;27;124;494;143.91431946294585
VILLARROBLEDO;VILLARROBLEDO;02600;CALLE ARQUIMEDES, 62;N;-2.583778;39.282167;02/12/2025 15:54;1.409;;;;;1.359;;1.149;;;;;;;;;;;;0.699;;;;;;;COMBUSTIBLES FIEL, S.L.;P;dm;L-S: 07:00-22:00;L-S: 07:00-22:00 (P);2025-12-02;Independiente;Albacete;Castilla - La Mancha;386464.0;193205.0;193259.0;5;9;14;14;42;129;489;141.18697122797275
VILLARROBLEDO;VILLARROBLEDO;02600;CARRETERA DE LAS MESAS KM. 005;N;-2.617083;39.27225;03/12/2025 09:57;1.499;;1.599;;;1.489;1.579;1.179;;;;;;;;;;;;0.799;;;;;;;MOEVE;P;dm;L-D: 06:00-22:30;Sin datos;2025-12-03;Petrolera;Albacete;Castilla - La Mancha;386464.0;193205.0;193259.0;0;5;14;14;40;128;497;140.75287824783888
VILLARROBLEDO;VILLARROBLEDO;02600;AVENIDA REYES CATÓLICOS, 108;N;-2.594111;39.272056;02/12/2025 19:01;1.399;;;;;1.279;;;;;;;;;;;;;;;;;;;;;E.S. VILLARROBLEDO;P;dm;L-D: 24H;L-D: 00:00-06:00 (D), 06:00-22:00 (A), 22:00-23:59 (D);2025-12-02;Independiente;Albacete;Castilla - La Mancha;386464.0;193205.0;193259.0;6;12;14;14;42;130;488;141.72740793963712
YESTE;YESTE;02480;CARRETERA DE HELLIN KM. 42;I;-2.314667;38.368667;03/12/2025 00:00;1.535;;;;;1.499;1.569;;;;;;;;;;;;;;;;;;;;CEPSA;P;OM;L-D: 07:00-21:00;L-D: 07:00-21:00 (P);2025-12-03;Petrolera;Albacete;Castilla - La Mancha;386464.0;193205.0;193259.0;0;0;0;0;5;37;360;157.39214185002663
AGOST;AGOST;03698;AUTOPISTA AP 7 KM. 696;I;-0.599444;38.408861;03/12/2025 13:15;1.574;;;1.694;;1.494;1.584;;;;;;;;;;;;;;;;;;;;GALP;P;OM;L-D: 24H;L-D: 24H (A);2025-12-03;Petrolera;Alicante/Alacant;Comunitat Valenciana;1881762.0;932018.0;949744.0;1;1;5;37;190;407;1087;13.180960934799074
AGOST;AGOST;03698;AUTOPISTA AP 7 KM. 696;D;-0.599972;38.406528;03/12/2025 14:30;1.589;;;1.709;;1.509;1.599;;;;;;;;;;;;;;;;;;;;GALP;P;OM;L-D: 24H;L-D: 24H (A);2025-12-03;Petrolera;Alicante/Alacant;Comunitat Valenciana;1881762.0;932018.0;949744.0;1;1;5;39;192;408;1087;12.998331700927045
AGOST;AGOST;03698;CARRETERA AGOST-NOVELDA KM 2 KM. 2;I;-0.66225;38.429417;01/12/2025 07:28;1.579;;;1.769;;1.499;1.599;1.269;;;;;;;;;;;;;;;;;;;CEPSA;P;dm;L-D: 06:00-22:00;L-D: 06:00-22:00 (A);2025-12-01;Petrolera;Alicante/Alacant;Comunitat Valenciana;1881762.0;932018.0;949744.0;0;0;1;13;190;406;1096;18.4920879497694
AGOST;AGOST;03698;CARRETERA SAN VICENTE - AGOST KM. 11;N;-0.63725;38.434417;02/12/2025 00:00;1.579;;;;;1.499;1.579;1.189;;;;;;;;;;;;0.85;;;;;;;PETRONOR;P;dm;L-D: 06:00-22:00;L-D: 06:00-22:00 (P);2025-12-02;Petrolera;Alicante/Alacant;Comunitat Valenciana;1881762.0;932018.0;949744.0;0;0;3;14;185;407;1095;17.43965157499039
ALBATERA;ALBATERA;03340;CARRETERA N-340 KM. 702,1;D;-0.848833;38.199389;02/12/2025 20:10;1.529;;;;;1.469;1.529;;;;;;;;;;;;;0.8;;;;;;;FTH;P;dm;L-D: 06:00-22:00;L-D: 06:00-22:00 (A);2025-12-02;Independiente;Alicante/Alacant;Comunitat Valenciana;1881762.0;932018.0;949744.0;1;1;8;30;173;564;986;32.03555508474291
ALBATERA;ALBATERA;03340;CALLE POLIGONO INDUSTRIAL MOS DEL BOU, CALLE EL ESPARTO, 5;D;-0.889167;38.168111;01/12/2025 06:00;1.469;;;;;1.459;1.529;;;;;;;;;;;;;;;;;;;;SUVER GASOLEOS ;P;dm;L-D: 24H;L-D: 24H (A);2025-12-01;Independiente;Alicante/Alacant;Comunitat Valenciana;1881762.0;932018.0;949744.0;1;3;13;32;169;567;977;36.691395628557196
ALBATERA;ALBATERA;03340;CARRETERA CATRAL-ALBATERA KM. 4,2;I;-0.854056;38.175028;03/12/2025 00:00;1.569;;;1.729;;1.529;;1.21;;;;;;0.989;1.199;1.149;;;;;1.619;;;;;;REPSOL;P;OM;L-D: 24H;L-D: 24H (P);2025-12-03;Petrolera;Alicante/Alacant;Comunitat Valenciana;1881762.0;932018.0;949744.0;1;2;14;42;170;567;979;33.60260960908035
ALBATERA;ALBATERA;03340;CARRETERA N-340 KM. 696,7;D;-0.89475;38.165222;01/12/2025 09:00;1.569;;;;;1.509;;1.219;;;;;;;;;;;;0.78;1.599;;;;;;REPSOL;P;dm;L-V: 06:00-22:00;Sin datos;2025-12-01;Petrolera;Alicante/Alacant;Comunitat Valenciana;1881762.0;932018.0;949744.0;1;3;10;34;171;567;974;37.27106797029354
ALBATERA;ALBATERA;03340;N-340 km 696,7;I;-0.848722;38.199417;01/12/2025 09:00;1.569;;;1.699;;1.509;;;;;;;;;;;;;;;1.599;;;;;;REPSOL;P;dm;L-D: 24H;L-D: 24H (A);2025-12-01;Petrolera;Alicante/Alacant;Comunitat Valenciana;1881762.0;932018.0;949744.0;1;1;8;30;173;564;986;32.02541366335927
ALCALALÍ;ALCALALI;03728;POLIGONO PLAZA MOSQUERA, 6;D;-0.042083;38.751972;02/12/2025 07:38;1.6;;;;;1.469;1.589;;;;;;;;;;;;;;;;;;;;REPSOL ;P;dm;L-D: 24H;L-D: 24H (P);2025-12-02;Petrolera;Alicante/Alacant;Comunitat Valenciana;1881762.0;932018.0;949744.0;0;0;2;14;99;228;949;63.67456614776788
ALCOY/ALCOI;ALCOY/ALCOI;03801;CALLE ALICANTE, 62;D;-0.479694;38.689083;01/12/2025 01:46;1.499;;;;;1.399;;;;;;;;0.959;;;;;;1.0;;;;;;;MASOIL ALCOY;P;dm;L-D: 24H;L-D: 24H (A);2025-12-01;Independiente;Alicante/Alacant;Comunitat Valenciana;1881762.0;932018.0;949744.0;6;6;13;18;59;412;1204;41.96491809580624
ALCOY/ALCOI;ALCOY/ALCOI;03801;CALLE ALACANT, 58;N;-0.480306;38.689278;03/12/2025 10:44;1.274;;;;;1.224;1.234;;;;;;;;;;;;;;;;;;;;BALLENOIL;P;OM;L-D: 24H;L-D: 24H (D);2025-12-03;Descuento;Alicante/Alacant;Comunitat Valenciana;1881762.0;932018.0;949744.0;5;6;13;18;60;412;1204;41.983087940054475
ALCOY/ALCOI;ALCOY/ALCOI;03801;CALLE ALACANT, 101;D;-0.471194;38.683806;03/12/2025 13:42;1.259;;;;;1.209;;;;;;;;;;;;;;;;;;;;;PLENERGY;P;dm;L-D: 24H;L-D: 24H (D);2025-12-03;Descuento;Alicante/Alacant;Comunitat Valenciana;1881762.0;932018.0;949744.0;4;6;13;18;58;414;1199;41.43533388590561
ALCOY/ALCOI;ALCOY/ALCOI;03801;CALLE ALICANTE, 62;D;-0.479611;38.688639;03/12/2025 14:00;1.479;;;1.619;;1.429;1.509;;;;;;;;;;;;;;;;;;;;SHELL;P;OM;L-D: 05:00-23:00;L-D: 05:00-23:00 (A);2025-12-03;Petrolera;Alicante/Alacant;Comunitat Valenciana;1881762.0;932018.0;949744.0;6;6;13;18;59;412;1204;41.91613111254306
ALCOY/ALCOI;ALCOY/ALCOI;03800;CALLE VALENCIA ESQ C/SANT JOAN BOSCO, 1;D;-0.46625;38.711556;01/12/2025 10:05;1.319;;;;;1.289;;;;;;;;;;;;;;;;;;;;;GASEXPRESS;P;dm;L-D: 24H;L-D: 24H (A);2025-12-01;Descuento;Alicante/Alacant;Comunitat Valenciana;1881762.0;932018.0;949744.0;5;6;18;21;59;412;1199;44.54655349382578
ALCOY/ALCOI;ALCOY/ALCOI;03800;AVENIDA TIRANT, S/N;D;-0.472556;38.70875;03/12/2025 00:00;1.549;;;1.709;;1.529;1.629;;;;;;;0.989;;;;;;;;;;;;;REPSOL;P;OM;L-D: 06:00-22:00;L-D: 06:00-22:00 (A);2025-12-03;Petrolera;Alicante/Alacant;Comunitat Valenciana;1881762.0;932018.0;949744.0;1;7;16;21;59;409;1204;44.19042468329951
ALCOY/ALCOI;ALCOY/ALCOI;03800;PG COTES BAIXES,CALLE C,PARC.1, 0;D;-0.462528;38.714361;03/12/2025 14:00;1.549;;1.619;1.709;;1.529;1.629;;;;;;;;;;;;;;;;;;;;REPSOL;P;OM;L-D: 06:00-22:00;L-D: 06:00-22:00 (A);2025-12-03;Petrolera;Alicante/Alacant;Comunitat Valenciana;1881762.0;932018.0;949744.0;5;6;18;21;60;415;1197;44.88676015437153
ALCOY/ALCOI;ALCOY/ALCOI;03800;N-340 km 131,000;N;-0.471306;38.683389;03/12/2025 09:45;1.339;;;1.499;;1.289;1.339;;;;;;;;;;;;;0.649;;;;;;;GALP;P;OM;L-D: 06:00-22:00;L-D: 06:00-22:00 (P);2025-12-03;Petrolera;Alicante/Alacant;Comunitat Valenciana;1881762.0;932018.0;949744.0;3;6;13;18;58;414;1198;41.38830944314615
ALCOY/ALCOI;ALCOY/ALCOI;03800;Alicante, 1 - P.I. Beniata;N;-0.477972;38.695083;03/12/2025 14:10;1.259;;;;;1.209;;;;;;;;;;;;;;;;;;;;;GASOLINERA ALCOY ;P;OM;L-D: 24H;L-D: 24H (D);2025-12-03;Independiente;Alicante/Alacant;Comunitat Valenciana;1881762.0;932018.0;949744.0;3;7;14;19;60;406;1202;42.6406189109771
ALCOY/ALCOI;ALCOY/ALCOI;03800;CALLE OLIVER, 72;D;-0.489722;38.691972;02/12/2025 00:00;1.569;;;1.709;;1.509;1.599;;;;;;;;;;;;;0.85;;;;;;;PETRONOR;P;dm;L-D: 06:00-22:00;L-D: 06:00-22:00 (P);2025-12-02;Petrolera;Alicante/Alacant;Comunitat Valenciana;1881762.0;932018.0;949744.0;3;6;13;19;62;412;1208;42.237506974312886
ALFÀS DEL PI (L');ALFAS DEL PI (L');03580;CALLE MALLORCA, CTRA. CV-763, 1;D;-0.0965;38.571139;03/12/2025 00:00;1.599;;;1.749;;1.509;1.609;;;;;;;;;;;;;;;;;;;;BP ALFAZ DEL PI;P;OM;L-D: 07:00-23:00;L-D: 07:00-23:00 (A);2025-12-03;Petrolera;Alicante/Alacant;Comunitat Valenciana;1881762.0;932018.0;949744.0;0;8;21;36;61;272;780;46.18225088007837
ALFÀS DEL PI (L');ALFAS DEL PI (L');03580;AVINGUDA PAIS VALENCIÁ, 37;D;-0.104972;38.580639;26/11/2025 14:26;1.399;;;;;1.369;;;;;;;;;;;;;;0.5;;;;;;;BEROIL;P;dm;L-D: 24H;"L-V: 00:00-08:59 (D), 08:59-16:59 (A), 16:59-23:59 (D); S-D: 24H (D)";2025-11-26;Descuento;Alicante/Alacant;Comunitat Valenciana;1881762.0;932018.0;949744.0;2;4;21;36;61;279;800;46.27885152506316
ALFÀS DEL PI (L');ALFAS DEL PI (L');03580;CL AVDA. DEL PAIS VALENCIANO S.N.;D;-0.105389;38.581361;03/12/2025 13:00;1.599;;;1.759;;1.509;1.609;;;;;;;;;;;;;;;;;;;;REPSOL;P;OM;L-D: 06:00-22:00;L-D: 06:00-22:00 (A);2025-12-03;Petrolera;Alicante/Alacant;Comunitat Valenciana;1881762.0;932018.0;949744.0;2;4;21;36;61;279;800;46.30274299742896
ALFÀS DEL PI (L');ALFAS DEL PI (L');03580;AVENIDA PAIS VALENCIÁ, 47;D;-0.106167;38.58225;03/12/2025 09:27;1.379;;;;;1.339;;;;;;;;;;;;;;;;;;;;;PLENERGY;P;dm;L-D: 24H;L-D: 24H (D);2025-12-03;Descuento;Alicante/Alacant;Comunitat Valenciana;1881762.0;932018.0;949744.0;2;4;21;36;61;280;801;46.31481821821594
ALFÀS DEL PI (L');ALFAS DEL PI (L');03580;AVENIDA ALBIR, 90;D;-0.076694;38.574028;03/12/2025 09:27;1.379;;;;;1.339;;;;;;;;;;;;;;;;;;;;;PLENERGY;P;dm;L-D: 24H;L-D: 24H (D);2025-12-03;Descuento;Alicante/Alacant;Comunitat Valenciana;1881762.0;932018.0;949744.0;1;3;18;35;62;263;767;47.73843856539724
ALFÀS DEL PI (L');ALFAS DEL PI (L');03581;AP-1535 km 2,000;N;-0.082972;38.567722;03/12/2025 14:30;1.534;;;1.664;;1.424;1.474;;;;;;;;;;;;;;;;;;;;GALP;P;OM;L-D: 06:00-22:00;L-D: 06:00-22:00 (A);2025-12-03;Petrolera;Alicante/Alacant;Comunitat Valenciana;1881762.0;932018.0;949744.0;1;5;18;35;62;265;771;46.87952847154765
ALGORFA;ALGORFA;03169;POLIGONO SECTOR VIII - EL ZOCO, S/N;N;-0.746611;38.058389;03/12/2025 00:00;1.569;;;1.719;;1.469;1.569;;;;;;;;;;;;;;;;;;;;BP EL ZOCO;P;OM;L-D: 06:00-22:00;L-D: 06:00-22:00 (A);2025-12-03;Petrolera;Alicante/Alacant;Comunitat Valenciana;1881762.0;932018.0;949744.0;0;3;12;54;175;566;927;34.94290888860418
ALGUEÑA;ALGUEÑA;03668;CALLE SAN JUAN, 32;D;-0.998222;38.339222;29/11/2025 08:15;1.509;;;;;1.429;1.489;1.239;;;;;;;;;;;;;;;;;;;CEPSA;P;dm;L-D: 06:30-21:00;L-D: 06:30-21:00 (A);2025-11-29;Petrolera;Alicante/Alacant;Comunitat Valenciana;1881762.0;932018.0;949744.0;0;0;0;3;72;530;1037;42.57024893750637
ALICANTE/ALACANT;ALICANTE/ALACANT;03013;AVENIDA PADRE ESPLÁ, 36;N;-0.47675;38.357;03/12/2025 00:00;1.559;;;;;1.479;;;;;;;;;;;;;;;;;;;;;REPSOL;P;OM;"L-V: 07:30-21:00; S: 08:00-15:00; D: 09:30-14:30";Sin datos;2025-12-03;Petrolera;Alicante/Alacant;Comunitat Valenciana;1881762.0;932018.0;949744.0;4;8;44;75;142;382;1042;5.798123533535689
ALICANTE/ALACANT;ALICANTE/ALACANT;03013;AVENIDA DENIA, 80;D;-0.466972;38.359278;03/12/2025 00:00;1.579;;;1.729;;1.479;1.579;;;;;;;;;;;;;;;;;;;;BP SANDOVAL MD;P;OM;L-D: 24H;L-D: 24H (P);2025-12-03;Petrolera;Alicante/Alacant;Comunitat Valenciana;1881762.0;932018.0;949744.0;3;7;35;75;137;375;1040;6.486219608682014
ALICANTE/ALACANT;ALICANTE/ALACANT;03013;AVENIDA DENIA, 75;I;-0.467361;38.359667;03/12/2025 00:00;1.579;;;1.729;;1.479;1.579;;;;;;;;;;;;;;;;;;;;BP SANDOVAL MI;P;OM;L-D: 24H;L-D: 24H (P);2025-12-03;Petrolera;Alicante/Alacant;Comunitat Valenciana;1881762.0;932018.0;949744.0;3;7;35;75;137;375;1041;6.500847534722719
ALICANTE/ALACANT;ALICANTE/ALACANT;03005;CALLE BULEVAR TEULADA, 86;I;-0.499917;38.364194;01/12/2025 17:07;1.419;;;;;1.357;;;;;;;;;;;;;;;;;;;;;AVANZA LOW COST;P;dm;L-D: 24H;"L-V: 00:00-09:30 (D), 09:30-12:30 (A), 12:30-16:30 (D), 16:30-20:30 (A), 20:30-23:59 (D); S: 00:00-09:00 (D), 09:00-14:00 (A), 14:00-23:59 (D); D: 24H (D)";2025-12-01;Independiente;Alicante/Alacant;Comunitat Valenciana;1881762.0;932018.0;949744.0;2;11;47;75;155;388;1049;5.834706730576841
ALICANTE/ALACANT;ALICANTE/ALACANT;03009;CALLE JATIVA, S/N;D;-0.504722;38.377722;01/12/2025 18:00;1.359;;;;;1.289;;;;;;;;;;;;;;;;;;;;;GM OIL;P;dm;L-D: 24H;L-D: 24H (A);2025-12-01;Independiente;Alicante/Alacant;Comunitat Valenciana;1881762.0;932018.0;949744.0;6;15;47;75;153;382;1053;7.275701180003579
ALICANTE/ALACANT;ALICANTE/ALACANT;03009;AVENIDA NOVELDA, 179;D;-0.4975;38.370222;03/12/2025 00:00;1.569;;;1.679;;1.479;1.569;;;;;;;;;;;;;;;;;;;;REPSOL;P;OM;L-D: 07:00-00:00;L-D: 07:00-23:59 (A);2025-12-03;Petrolera;Alicante/Alacant;Comunitat Valenciana;1881762.0;932018.0;949744.0;7;12;48;76;153;383;1050;6.531872950280768
ALICANTE/ALACANT;ALICANTE/ALACANT;03009;CALLE FORTUNY, S/N;I;-0.499444;38.375333;03/12/2025 00:00;1.569;;;1.699;;1.479;1.569;;;;;;;;;;;;;;;;;;;;REPSOL;P;OM;"L-V: 07:30-21:30; S-D: 08:30-14:30";"L-V: 07:30-21:30 (A); S-D: 08:30-14:30 (A)";2025-12-03;Petrolera;Alicante/Alacant;Comunitat Valenciana;1881762.0;932018.0;949744.0;7;13;49;76;153;382;1051;7.064086827975451
ALICANTE/ALACANT;ALICANTE/ALACANT;03009;AVENIDA DE LA UNIVERSIDAD, SN;D;-0.508861;38.376194;03/12/2025 11:00;1.579;;;1.709;;1.489;;;;;;;;0.979;;;;;;;1.579;;;;;;REPSOL;P;OM;L-D: 24H;L-D: 24H (A);2025-12-03;Petrolera;Alicante/Alacant;Comunitat Valenciana;1881762.0;932018.0;949744.0;6;14;47;75;155;385;1053;7.0859101358629655
ALICANTE/ALACANT;ALICANTE/ALACANT;03009;AVENIDA UNIVERSIDAD, S/N;N;-0.506833;38.374139;03/12/2025 14:00;1.549;;;1.689;;1.459;1.539;;;;;;;0.919;;;;;;;;;;;;;SHELL;P;OM;L-D: 24H;L-D: 24H (A);2025-12-03;Petrolera;Alicante/Alacant;Comunitat Valenciana;1881762.0;932018.0;949744.0;7;14;48;75;155;384;1052;6.865507013662429
ALICANTE/ALACANT;ALICANTE/ALACANT;03010;AVENIDA NOVELDA, 74;D;-0.494333;38.364222;03/12/2025 09:27;1.377;;;;;1.329;;;;;;;;;;;;;;;;;;;;;PLENERGY;P;dm;L-D: 24H;L-D: 24H (D);2025-12-03;Descuento;Alicante/Alacant;Comunitat Valenciana;1881762.0;932018.0;949744.0;3;12;47;73;154;385;1049;5.940732752138545
ALICANTE/ALACANT;ALICANTE/ALACANT;03012;AVENIDA JIJONA, 88;D;-0.483944;38.358556;03/12/2025 06:47;1.579;;;1.709;;1.499;1.559;;;;;;;;;;;;;;;;;;;;REPSOL;P;dm;"L-S: 06:30-22:30; D: 07:00-22:30";"L-S: 06:30-22:30 (A); D: 07:00-22:30 (A)";2025-12-03;Petrolera;Alicante/Alacant;Comunitat Valenciana;1881762.0;932018.0;949744.0;1;8;44;74;145;385;1045;5.653434542344147
ALICANTE/ALACANT;ALICANTE/ALACANT;03015;AVENIDA ANTONIO RAMOS CARRATALA, 56;N;-0.466806;38.370694;01/12/2025 11:14;1.409;;;1.519;;1.289;1.389;;;;;;;;;;;;;;;;;;;;ALCAMPO;P;dm;L-D: 24H;"L-S: 00:00-08:00 (D), 08:00-21:59 (A), 21:59-23:59 (D); D: 00:00-08:30 (D), 08:30-21:59 (A), 21:59-23:59 (D)";2025-12-01;Supermercado;Alicante/Alacant;Comunitat Valenciana;1881762.0;932018.0;949744.0;2;10;37;78;129;369;1043;7.549700599882418
ALICANTE/ALACANT;ALICANTE/ALACANT;03540;AVDA. DE LA CONDOMINA, 47 (C-190 km 3,7);D;-0.434556;38.363639;03/12/2025 10:00;1.575;;1.625;;;1.499;1.589;;;;;;;;;;;;;;;;;;;;MOEVE;P;OM;L-D: 24H;L-D: 24H (A);2025-12-03;Petrolera;Alicante/Alacant;Comunitat Valenciana;1881762.0;932018.0;949744.0;0;2;19;71;119;363;1037;8.789405078610939
ALICANTE/ALACANT;ALICANTE/ALACANT;03016;CALLE ANTONIO RAMOS CARRATALÁ, 26;D;-0.464083;38.369889;01/12/2025 12:46;1.409;;;;;1.289;;;;;;;;;;;;;;;;;;;;;PLENERGY;P;dm;L-D: 24H;L-D: 24H (D);2025-12-01;Descuento;Alicante/Alacant;Comunitat Valenciana;1881762.0;932018.0;949744.0;2;10;37;77;129;367;1043;7.59943099430936
ALICANTE/ALACANT;ALICANTE/ALACANT;03016;AVENIDA DENIA, 60;N;-0.472306;38.355389;02/12/2025 10:20;1.569;;;1.719;;1.479;1.579;;;;;;;0.979;;;;;;0.939;;;;;;;GOTETA;P;dm;L-D: 24H;L-D: 00:00-07:00 (A), 07:00-23:00 (P), 23:00-23:59 (A);2025-12-02;Independiente;Alicante/Alacant;Comunitat Valenciana;1881762.0;932018.0;949744.0;3;6;40;74;140;380;1042;5.862673354169218
ALICANTE/ALACANT;ALICANTE/ALACANT;03016;VIAL CONEXION N-332 Y A-7, S/N;N;-0.446667;38.37;01/12/2025 10:51;1.579;;;1.729;;1.469;1.469;;;;;;;;;;;;;;;;;;;;GALP;P;dm;L-D: 06:00-22:00;Sin datos;2025-12-01;Petrolera;Alicante/Alacant;Comunitat Valenciana;1881762.0;932018.0;949744.0;3;8;29;76;120;363;1040;8.529490537709943
ALICANTE/ALACANT;ALICANTE/ALACANT;03016;AVENIDA DENIA, 0;D;-0.457694;38.371389;01/12/2025 12:46;1.439;;;;;1.319;;;;;;;;;;;;;;;;;;;;;PLENERGY;P;dm;L-D: 24H;L-D: 24H (D);2025-12-01;Descuento;Alicante/Alacant;Comunitat Valenciana;1881762.0;932018.0;949744.0;4;9;33;76;125;365;1042;8.050885784268086
ALICANTE/ALACANT;ALICANTE/ALACANT;03016;VIAL FLORA DE ESPAÑA, 28;N;-0.444778;38.369111;02/12/2025 17:00;1.558;;;1.648;;1.478;1.558;;;;;;;0.894;;;;;;;;;;;;;AVANZA ENERGY;P;dm;L-D: 06:30-22:00;L-D: 06:30-22:00 (P);2025-12-02;Independiente;Alicante/Alacant;Comunitat Valenciana;1881762.0;932018.0;949744.0;1;8;29;76;120;363;1040;8.56654257235591
ALICANTE/ALACANT;ALICANTE/ALACANT;03016;AVENIDA DENIA, 150;D;-0.453806;38.375472;03/12/2025 00:00;1.579;;;1.729;;1.479;1.579;;;;;;;;;;;;;;;;;;;;BP VISTAHERMOSA ;P;OM;L-D: 07:00-23:00;L-D: 07:00-23:00 (P);2025-12-03;Petrolera;Alicante/Alacant;Comunitat Valenciana;1881762.0;932018.0;949744.0;2;7;35;76;123;363;1041;8.617349110235413
ALICANTE/ALACANT;ALICANTE/ALACANT;03112;CALLE MUSICO JOSE TORREGROSA, 33;D;-0.48975;38.383583;01/12/2025 17:06;1.419;;;;;1.357;;;;;;;;;;;;;;;;;;;;;AVANZA LOW COST;P;dm;L-D: 24H;"L-V: 00:00-09:00 (D), 09:00-12:00 (A), 12:00-16:30 (D), 16:30-20:30 (A), 20:30-23:59 (D); S: 00:00-09:00 (D), 09:00-14:00 (A), 14:00-23:59 (D); D: 24H (D)";2025-12-01;Independiente;Alicante/Alacant;Comunitat Valenciana;1881762.0;932018.0;949744.0;0;10;36;80;146;377;1052;8.126427997328333
ALICANTE/ALACANT;ALICANTE/ALACANT;03112;CARRETERA A-214 KM. 5;I;-0.47775;38.401;03/12/2025 00:00;1.559;;;1.679;;1.479;1.579;;;;;;;;;;;;;;;;;;;;REPSOL;P;OM;L-D: 06:00-22:00;L-D: 06:00-22:00 (A);2025-12-03;Petrolera;Alicante/Alacant;Comunitat Valenciana;1881762.0;932018.0;949744.0;0;1;42;78;128;381;1053;10.268853743007684
ALICANTE/ALACANT;ALICANTE/ALACANT;03011;AVENIDA NOVELDA, 216;D;-0.499722;38.376944;03/12/2025 12:51;1.377;;;;;1.329;;;;;;;;;;;;;;;;;;;;;PETROPRIX;P;dm;L-D: 24H;L-D: 24H (A);2025-12-03;Descuento;Alicante/Alacant;Comunitat Valenciana;1881762.0;932018.0;949744.0;7;14;50;76;153;382;1051;7.237855159763918
ALICANTE/ALACANT;ALICANTE/ALACANT;03011;AVENIDA NOVELDA, 204;D;-0.498972;38.375972;01/12/2025 17:45;1.444;;;;;1.333;;;;;;;;;;;;;;;;;;;;;VCC ALICANTE ;P;dm;L-D: 24H;L-D: 24H (A);2025-12-01;Independiente;Alicante/Alacant;Comunitat Valenciana;1881762.0;932018.0;949744.0;7;13;49;76;153;381;1051;7.140501201793699
ALICANTE/ALACANT;ALICANTE/ALACANT;03011;AVENIDA PINTOR GASTON CASTELLO, 1;I;-0.486611;38.370083;03/12/2025 00:00;1.579;;;1.729;;1.479;1.579;;;;;;;;;;;;;;;;;;;;BP REJAS VERDES;P;OM;L-D: 06:00-22:00;L-D: 06:00-22:00 (P);2025-12-03;Petrolera;Alicante/Alacant;Comunitat Valenciana;1881762.0;932018.0;949744.0;2;14;47;76;146;380;1046;6.758074268321246
ALICANTE/ALACANT;SANTA FAZ;03559;AVENIDA DE DENIA, 183;I;-0.449972;38.385639;03/12/2025 10:54;1.567;;1.667;;;1.486;1.589;;;;;;;;;;;;;;;;;;;;E.S. SANTA FAZ;P;dm;L-D: 06:30-22:30;L-D: 06:30-22:30 (A);2025-12-03;Independiente;Alicante/Alacant;Comunitat Valenciana;1881762.0;932018.0;949744.0;1;6;39;76;120;365;1046;9.738356390644764
ALICANTE/ALACANT;SANTA FAZ;03559;CARRETERA 112,6 KM. N-332;D;-0.447417;38.38625;03/12/2025 14:00;1.579;;;1.709;;1.489;1.579;;;;;;;;;;;;;;;;;;;;REPSOL;P;OM;L-D: 06:30-22:30;L-D: 06:30-22:30 (A);2025-12-03;Petrolera;Alicante/Alacant;Comunitat Valenciana;1881762.0;932018.0;949744.0;1;8;36;76;120;364;1044;9.918754872881381
ALICANTE/ALACANT;ALICANTE/ALACANT;03006;POLIGONO PLA VALLONGA CALLE 8, PARCELA 15;D;-0.555389;38.34825;02/12/2025 17:00;1.558;;;1.648;;1.478;1.558;1.272;;;;;;;;;;;;0.892;;;;;;;AVANZA ENERGY;P;dm;"L-V: 06:00-21:30; S: 07:00-15:00";"L-V: 06:00-21:30 (P); S: 07:00-15:00 (P)";2025-12-02;Independiente;Alicante/Alacant;Comunitat Valenciana;1881762.0;932018.0;949744.0;1;4;18;68;173;394;1051;5.52494481906726
ALICANTE/ALACANT;ALICANTE/ALACANT;03006;CALLE OCAÑA, 16;D;-0.522278;38.345056;03/12/2025 10:44;1.387;;;;;1.339;;;;;;;;;;;;;;;;;;;;;BALLENOIL;P;OM;L-D: 24H;L-D: 24H (D);2025-12-03;Descuento;Alicante/Alacant;Comunitat Valenciana;1881762.0;932018.0;949744.0;9;14;34;75;156;394;1047;3.7423531264507277
ALICANTE/ALACANT;ALICANTE/ALACANT;03006;CARRETERA N-330A KM. 407,7;D;-0.545111;38.343611;01/12/2025 14:55;1.585;;;;;1.509;1.599;1.279;;;;;;;;;;;;;;;;;;;CEPSA;P;dm;L-V: 05:00-21:00;L-V: 05:00-21:00 (A);2025-12-01;Petrolera;Alicante/Alacant;Comunitat Valenciana;1881762.0;932018.0;949744.0;2;7;23;72;170;396;1050;4.540310198738163
ALICANTE/ALACANT;ALICANTE/ALACANT;03006;CARRETERA N-330 KM. 409;I;-0.523167;38.344944;03/12/2025 00:00;1.569;;;1.689;;1.499;1.589;;;;;;;;;;;;;;;;;;;;PETRONOR;P;OM;L-D: 06:30-21:00;L-D: 06:30-21:00 (A);2025-12-03;Petrolera;Alicante/Alacant;Comunitat Valenciana;1881762.0;932018.0;949744.0;9;15;34;73;157;394;1047;3.7507829181647914
ALICANTE/ALACANT;ALICANTE/ALACANT;03006;AVENIDA NEPTUNO, 4;D;-0.524194;38.344;03/12/2025 13:50;1.543;;;1.653;;1.469;1.569;;;;;;;;;;;;;0.9;;;;;;;CONFORT AUTO;P;dm;"L-V: 06:00-22:00; S: 07:00-15:00";"L-V: 06:00-22:00 (A); S: 07:00-15:00 (A)";2025-12-03;Independiente;Alicante/Alacant;Comunitat Valenciana;1881762.0;932018.0;949744.0;9;15;33;72;157;395;1049;3.676134690534726
ALICANTE/ALACANT;ALICANTE/ALACANT;03006;CARRETERA MADRID ESQ.RIO JUCAR KM. 19;D;-0.522944;38.344611;03/12/2025 00:00;1.569;;;1.689;;1.499;1.589;;;;;;;0.979;;;;;;;;;;;;;REPSOL;P;OM;"L-V: 06:00-22:00; S-D: 07:00-21:00";"L-V: 06:00-22:00 (A); S-D: 07:00-21:00 (A)";2025-12-03;Petrolera;Alicante/Alacant;Comunitat Valenciana;1881762.0;932018.0;949744.0;9;14;34;73;157;394;1047;3.709855855794475
ALICANTE/ALACANT;ALICANTE/ALACANT;03006;AVDA. ORIHUELA, S/N - ESQUINA VIA PARQUE;N;-0.517889;38.345583;02/12/2025 15:00;1.569;;;1.709;;1.479;1.559;;;;;;;0.919;;;;;;;;;;;;;SHELL;P;OM;L-D: 06:00-00:00;L-D: 06:00-23:59 (A);2025-12-02;Petrolera;Alicante/Alacant;Comunitat Valenciana;1881762.0;932018.0;949744.0;9;14;38;73;156;393;1047;3.7219531560680963
ALICANTE/ALACANT;ALICANTE/ALACANT;03008;CALLE ARTES GRAFICAS, 89;N;-0.512833;38.335694;01/12/2025 11:15;1.427;;;1.649;;1.444;;;;;;1.434;;;;;;;;0.899;;;;;;;TAMOIL;P;OM;L-D: 24H;L-D: 24H (A);2025-12-01;Petrolera;Alicante/Alacant;Comunitat Valenciana;1881762.0;932018.0;949744.0;5;13;33;71;156;394;1046;2.5820828788415437
ALICANTE/ALACANT;ALICANTE/ALACANT;03008;AVENIDA ELCHE, 150;I;-0.521389;38.303611;03/12/2025 12:51;1.387;;;;;1.339;;;;;;;;;;;;;;;;;;;;;PETROPRIX;P;dm;L-D: 24H;L-D: 24H (A);2025-12-03;Descuento;Alicante/Alacant;Comunitat Valenciana;1881762.0;932018.0;949744.0;0;0;20;59;164;394;1030;1.3178013341369361
ALICANTE/ALACANT;ALICANTE/ALACANT;03008;AVENIDA ELCHE (N-332 P.K. 102), 16;I;-0.500389;38.337778;03/12/2025 11:00;1.559;;1.645;;;1.485;1.549;;;;;;;;;;;;;;;;;;;;MOEVE;P;OM;L-D: 24H;L-D: 24H (A);2025-12-03;Petrolera;Alicante/Alacant;Comunitat Valenciana;1881762.0;932018.0;949744.0;0;9;36;71;155;393;1046;2.9703730162324855
ALICANTE/ALACANT;ALICANTE/ALACANT;03008;CALLE COMUNICACIONES, DE LAS, 10;N;-0.517389;38.336083;01/12/2025 10:08;;;;;;1.43;;;;;;;;;;;;;;;;;;;;;ALSA;R;dm;L-D: 08:00-23:00;L-D: 08:00-23:00 (A);2025-12-01;Independiente;Alicante/Alacant;Comunitat Valenciana;1881762.0;932018.0;949744.0;6;13;32;70;157;395;1049;2.673846891195812
ALICANTE/ALACANT;ALICANTE/ALACANT;03008;AVENIDA RAMÓN GÓMEZ SEMPERE, 4;N;-0.5135;38.330583;20/11/2025 10:41;1.589;;;1.739;;1.499;1.589;;;;;;;;;;;;;;;;;;;;GALP;P;dm;L-D: 06:00-22:00;Sin datos;2025-11-20;Petrolera;Alicante/Alacant;Comunitat Valenciana;1881762.0;932018.0;949744.0;3;13;26;68;157;395;1046;2.0190661981315574
ALICANTE/ALACANT;ALICANTE/ALACANT;03007;AVENIDA ALCALDE LORENZO CARBONELL, 71;I;-0.516;38.338611;03/12/2025 14:00;1.549;;1.649;;;1.499;1.604;;;;;;;;;;;;;;;;;;;;MOEVE;P;OM;L-D: 06:00-22:00;L-D: 06:00-22:00 (A);2025-12-03;Petrolera;Alicante/Alacant;Comunitat Valenciana;1881762.0;932018.0;949744.0;12;13;35;71;156;395;1047;2.9310084805331935
ALICANTE/ALACANT;ALICANTE/ALACANT;03007;CARRETERA OCAÑA KM. 7;I;-0.518333;38.344917;02/12/2025 17:00;1.558;;;1.648;;1.478;1.558;;;;;;;0.894;;;;;;;;;;;;;AVANZA ENERGY;P;dm;L-D: 24H;L-D: 00:00-06:30 (D), 06:30-21:30 (P), 21:30-23:59 (D);2025-12-02;Independiente;Alicante/Alacant;Comunitat Valenciana;1881762.0;932018.0;949744.0;10;14;37;74;156;393;1047;3.6549847724981315
ALICANTE/ALACANT;ALICANTE/ALACANT;03007;Rosa de los Vientos (esq. Camino Viejo de Elche);N;-0.523139;38.337778;01/12/2025 11:00;1.569;;;1.719;;1.46;1.559;;;;;;;;;;;;;;;;;;;;GALP;P;dm;"L-V: 06:00-22:00; S-D: 06:00-14:00";Sin datos;2025-12-01;Petrolera;Alicante/Alacant;Comunitat Valenciana;1881762.0;932018.0;949744.0;11;14;32;70;159;395;1049;2.9915122778443974
ALICANTE/ALACANT;ALICANTE/ALACANT;03007;N-330-P.K. 409,1 P.I. El Espartal;N;-0.520556;38.34525;01/12/2025 11:02;1.569;;;1.719;;1.469;1.559;;;;;;;;;;;;;;;;;;;;GALP;P;dm;"L-V: 06:00-22:00; S: 06:00-14:00";Sin datos;2025-12-01;Petrolera;Alicante/Alacant;Comunitat Valenciana;1881762.0;932018.0;949744.0;9;14;36;75;156;394;1047;3.728184559592603
ALICANTE/ALACANT;ALICANTE/ALACANT;03007;CALLE ALCALDE LORENZO CARBONELL, S/N ESQUINA VIA PARQUE, S/N;N;-0.51775;38.340028;03/12/2025 10:38;1.519;;;;;1.449;1.489;;;;;;;;;;;;;;;;;;;;CARREFOUR;P;dm;L-D: 24H;L-D: 24H (A);2025-12-03;Supermercado;Alicante/Alacant;Comunitat Valenciana;1881762.0;932018.0;949744.0;11;14;35;71;156;396;1047;3.110689505789572
ALICANTE/ALACANT;BACAROT (EL);03114;POLIGONO ZONA INDUSTRIAL A, POLIGONO B, S/N;D;-0.538472;38.344139;03/12/2025 00:00;1.577;;1.654;;;1.489;1.594;1.274;;;;;;;;;;;;;;;;;;;MOEVE;P;OM;L-D: 24H;L-D: 24H (A);2025-12-03;Petrolera;Alicante/Alacant;Comunitat Valenciana;1881762.0;932018.0;949744.0;2;12;28;72;163;397;1050;4.237159506790792
ALICANTE/ALACANT;MORALET;03699;CARRETERA CV 820 KM. 1,4;I;-0.565972;38.411;02/12/2025 09:19;1.559;;;1.999;;1.459;1.509;;;;;;;;;;;;;;;;;;;;AQUAVEL;P;dm;L-D: 24H;L-D: 24H (A);2025-12-02;Independiente;Alicante/Alacant;Comunitat Valenciana;1881762.0;932018.0;949744.0;1;1;10;52;183;403;1078;11.941559517734897
ALICANTE/ALACANT;MORALET;03699;CARRETERA CV 820 KM. 1,3;D;-0.565444;38.4115;02/12/2025 09:19;1.599;;;1.699;;1.499;1.579;;;;;;;;;;;;;1.599;;;;;;;REPSOL;P;dm;L-D: 06:00-22:00;L-D: 06:00-22:00 (A);2025-12-02;Petrolera;Alicante/Alacant;Comunitat Valenciana;1881762.0;932018.0;949744.0;1;1;11;52;183;403;1078;11.974376958791561
ALICANTE/ALACANT;ALICANTE/ALACANT;03114;CARRETERA BACAROT, 4 KM. ;D;-0.545833;38.343333;01/12/2025 09:28;;;;;;;;1.15;;;;;;;;;;;;;;;;;;;AGRICOOP;R;dm;"L-V: 08:00-14:00 y 16:00-18:00; S: 08:00-12:00";"L-V: 08:00-14:00 (A), 16:00-18:00 (A); S: 08:00-12:00 (A)";2025-12-01;Independiente;Alicante/Alacant;Comunitat Valenciana;1881762.0;932018.0;949744.0;3;5;22;71;170;396;1050;4.5580580778794015
ALICANTE/ALACANT;ALICANTE/ALACANT;03114;AVENIDA DEL EURO, 9;D;-0.57275;38.340861;01/12/2025 20:35;1.582;;;;;1.522;;;;;;;;;;;;;;;;;;;;;PARCELOGIC;P;dm;L-D: 24H;L-D: 24H (D);2025-12-01;Independiente;Alicante/Alacant;Comunitat Valenciana;1881762.0;932018.0;949744.0;0;1;17;62;178;399;1060;6.211688579068625
ALMORADÍ;ALMORADI;03160;AVENIDA DOCTOR MARAÑON, 0;D;-0.782111;38.104472;02/12/2025 11:33;1.419;;1.499;;;1.369;1.439;;;;;;;;;;;;;0.85;;;;;;;GASOLEO EXPRES;P;dm;"L-S: 06:00-22:00; D: 07:00-22:00";"L-S: 06:00-22:00 (P); D: 07:00-22:00 (P)";2025-12-02;Independiente;Alicante/Alacant;Comunitat Valenciana;1881762.0;932018.0;949744.0;0;3;11;35;186;561;952;33.0836725346518
ALMORADÍ;ALMORADI;03160;AVENIDA COMUNIDAD EUROPEA, 1;D;-0.796528;38.099361;01/12/2025 14:37;1.449;;;1.619;;1.409;1.479;1.169;;;;;;;;;;;;;;;;;;;LAS MAROMAS;P;dm;L-D: 06:30-22:30;L-D: 06:30-22:30 (A);2025-12-01;Independiente;Alicante/Alacant;Comunitat Valenciana;1881762.0;932018.0;949744.0;1;3;9;43;185;561;954;34.38551434629795
ALMORADÍ;ALMORADI;03160;CARRETERA C-3321 KM. 38,1;I;-0.781806;38.123556;03/12/2025 14:00;1.589;;1.639;;;1.509;1.589;1.244;;;;;;;;;;;;;;;;;;;CEPSA;P;OM;L-D: 06:00-22:00;L-D: 06:00-22:00 (A);2025-12-03;Petrolera;Alicante/Alacant;Comunitat Valenciana;1881762.0;932018.0;949744.0;1;4;10;39;192;555;969;31.614137510071018
ALMORADÍ;ALMORADI;03160;CALLE REINO UNIDO, 1;D;-0.800556;38.100389;01/12/2025 22:40;1.399;;;;;1.369;;;;;;;;;;;;;;;;;;;;;LAS MAROMAS-2;P;dm;L-D: 24H;L-D: 24H (A);2025-12-01;Independiente;Alicante/Alacant;Comunitat Valenciana;1881762.0;932018.0;949744.0;1;3;9;46;187;562;954;34.563128365302504
ALMORADÍ;ALMORADI;03160;CALLE PARTIDA DE LA ERA ALTA, 57;I;-0.783083;38.122583;03/12/2025 12:51;1.389;;;;;1.359;;;;;;;;;;;;;;;;;;;;;PETROPRIX;P;dm;L-D: 24H;L-D: 24H (A);2025-12-03;Descuento;Alicante/Alacant;Comunitat Valenciana;1881762.0;932018.0;949744.0;2;3;9;39;191;555;968;31.769519045184108
ALMORADÍ;ALMORADI;03160;Principe De EspañA, 10;N;-0.78875;38.115139;03/12/2025 06:00;1.589;;;1.739;;1.509;1.609;;;;;;;;;;;;;;;;;;;;BP;P;dm;"L-V: 06:00-22:00; S-D: 07:00-22:00";"L-V: 06:00-22:00 (A); S-D: 07:00-22:00 (A)";2025-12-03;Petrolera;Alicante/Alacant;Comunitat Valenciana;1881762.0;932018.0;949744.0;1;5;8;39;191;560;958;32.69179869136841
ALTEA;ALTEA;03590;CALLE CUESTA DE LAS NARICES, 11;I;-0.056056;38.594194;03/12/2025 12:51;1.379;;;;;1.339;;;;;;;;;;;;;;;;;;;;;PETROPRIX ;P;dm;L-D: 24H;L-D: 24H (A);2025-12-03;Descuento;Alicante/Alacant;Comunitat Valenciana;1881762.0;932018.0;949744.0;1;3;11;25;73;257;787;50.53005357418645
ALTEA;ALTEA;03590;CARRETERA N-332 KM. 155,5;I;-0.064694;38.586556;03/12/2025 00:00;1.599;;;1.759;;1.489;1.589;;;;;;;;;;;;;;;;;;;;REPSOL;P;OM;L-D: 06:00-22:00;Sin datos;2025-12-03;Petrolera;Alicante/Alacant;Comunitat Valenciana;1881762.0;932018.0;949744.0;0;3;13;25;63;260;773;49.415382244729585
ALTEA;ALTEA;03590;CALLE GARGANES, 42;D;-0.048611;38.604722;03/12/2025 10:00;1.609;;;1.769;;1.499;1.599;;;;;;;;;;;;;;;;;;;;REPSOL;P;OM;L-D: 06:00-00:00;L-D: 06:00-23:59 (A);2025-12-03;Petrolera;Alicante/Alacant;Comunitat Valenciana;1881762.0;932018.0;949744.0;0;2;6;30;77;245;808;51.76472518495261
ALTEA;ALTEA;03590;CARRETERA LA NUCIA KM. 2,8;D;-0.078472;38.605917;03/12/2025 00:00;1.599;;;1.759;;1.489;1.589;;;;;;;;;;;;;;;;;;;;REPSOL;P;OM;L: 07:00-22:00;"L-V: 07:00-20:00 (A); S-D: 08:00-20:00 (A)";2025-12-03;Petrolera;Alicante/Alacant;Comunitat Valenciana;1881762.0;932018.0;949744.0;0;0;15;25;73;267;825;49.85413497342298
ALTEA;ALTEA;03590;Carrer De La Mar, 157;N;-0.054917;38.593222;20/11/2025 10:42;1.589;;;1.739;;1.479;1.569;;;;;;;;;;;;;;;;;;;;GALP;P;dm;L-D: 07:00-23:00;L-D: 07:00-23:00 (A);2025-11-20;Petrolera;Alicante/Alacant;Comunitat Valenciana;1881762.0;932018.0;949744.0;1;3;11;25;73;257;782;50.54130512429574
ALTEA;ALTEA LA VELLA;03599;CARRETERA CV-755 KM. 9,2;I;-0.0385;38.62675;01/12/2025 11:10;1.629;;;1.785;;1.549;1.635;;;;;;;;;;;;;;;;;;;;CEPSA ELF;P;dm;L-D: 06:00-22:00;L-D: 06:00-22:00 (A);2025-12-01;Petrolera;Alicante/Alacant;Comunitat Valenciana;1881762.0;932018.0;949744.0;0;0;4;27;80;245;835;53.999750058177256
ASPE;ASPE;03680;AVD.DE NAVARRA 151;N;-0.772639;38.354028;01/12/2025 11:37;1.568;;;1.698;;1.498;1.598;;;;;;;;;;;;;;;;;;;;CEPSA ESPAÑA S.A.;P;dm;L-D: 07:00-22:00;L-D: 07:00-22:00 (A);2025-12-01;Petrolera;Alicante/Alacant;Comunitat Valenciana;1881762.0;932018.0;949744.0;3;6;14;25;166;444;1097;23.249264693225086
ASPE;ASPE;03680;CARRETERA NOVELDA KM. 22;D;-0.770917;38.358167;03/12/2025 13:50;1.385;;;1.678;;1.336;1.479;;;;;;;;;;;;;0.68;;;;;;;CONFORT AUTO;P;dm;"L-V: 06:00-22:00; S: 08:00-15:00";"L-V: 06:00-22:00 (A); S: 08:00-15:00 (A)";2025-12-03;Independiente;Alicante/Alacant;Comunitat Valenciana;1881762.0;932018.0;949744.0;3;4;15;24;166;438;1099;23.19782362225148
ASPE;ASPE;03680;AVENIDA 3 DE AGOSTO, 23;D;-0.774111;38.336722;01/12/2025 06:00;1.569;;;1.679;;1.489;;1.199;;;;;;;;;;;;;1.589;;;;;;REPSOL;P;dm;L-D: 06:00-22:00;"L-V: 06:00-21:00 (A); S-D: 07:00-21:00 (A)";2025-12-01;Petrolera;Alicante/Alacant;Comunitat Valenciana;1881762.0;932018.0;949744.0;2;4;9;40;177;476;1092;23.07492955194958
ASPE;ASPE;03680;AVENIDA TRES DE AGOSTO, 20;D;-0.773361;38.341583;01/12/2025 04:15;1.377;;;;;1.327;;;;;;;;;;;;;;;;;;;;;PLENERGY;P;dm;L-D: 24H;L-D: 24H (A);2025-12-01;Descuento;Alicante/Alacant;Comunitat Valenciana;1881762.0;932018.0;949744.0;2;7;10;32;174;471;1094;23.078706420447514
ASPE;ASPE;03680;POLIGONO C/ IBI, S/N;D;-0.770417;38.356139;02/12/2025 12:47;1.569;;;;;1.479;1.579;;;;;;;;;;;;;0.79;;;;;;;LEVANTINA;P;dm;L-S: 06:00-22:00;L-S: 06:00-22:00 (A);2025-12-02;Independiente;Alicante/Alacant;Comunitat Valenciana;1881762.0;932018.0;949744.0;3;4;15;26;169;441;1099;23.107176921592874
ASPE;ASPE;03680;CR N-325, 5,8;I;-0.772833;38.3555;01/12/2025 13:12;1.387;;1.387;;;1.337;1.337;;;;;;;0.968;;;;;;0.707;;;;;;;RASPA-OIL (SERV. ATENDIDO);P;dm;L-D: 24H;Sin datos;2025-12-01;Independiente;Alicante/Alacant;Comunitat Valenciana;1881762.0;932018.0;949744.0;3;4;14;26;168;441;1098;23.29866086776309
ASPE;ASPE;03680;POLIGONO TRES HERMANAS   ALCOHOLERA, 11;N;-0.767139;38.325917;03/12/2025 00:01;1.579;;;1.729;;1.509;1.609;;;;;;;;;;;;;;;;;;;;BP;P;dm;"L-S: 06:00-22:00; D: 07:00-15:00";"L-S: 06:00-22:00 (A); D: 07:00-15:00 (A)";2025-12-03;Petrolera;Alicante/Alacant;Comunitat Valenciana;1881762.0;932018.0;949744.0;0;3;7;47;184;472;1086;22.360499474401852
ASPE;ASPE;03680;AVENIDA AVENIDA DE ORIHUELA, 101;N;-0.777556;38.336861;22/11/2025 14:11;1.379;;;;;1.329;;;;;;;;;;;;;;;;;;;;;GASOLINERA ASPE;P;OM;L-D: 24H;L-D: 00:00-06:00 (D), 06:00-22:00 (A), 22:00-23:59 (D);2025-11-22;Independiente;Alicante/Alacant;Comunitat Valenciana;1881762.0;932018.0;949744.0;2;4;9;39;179;479;1092;23.375184886203957
BANYERES DE MARIOLA;BANYERES DE MARIOLA;03450;CALLE PADRE JESUALDO FERRERO, 1;N;-0.664056;38.715917;03/12/2025 00:00;1.569;;;;;1.509;1.599;;;;;;;;;;;;;0.85;;;;;;;REPSOL;P;dm;L-D: 06:00-22:00;L-D: 06:00-22:00 (P);2025-12-03;Petrolera;Alicante/Alacant;Comunitat Valenciana;1881762.0;932018.0;949744.0;1;1;2;4;87;344;1296;46.78288000965711
BANYERES DE MARIOLA;BANYERES DE MARIOLA;03450;CALLE LES MOLINES, 35, ;N;-0.671194;38.720111;20/11/2025 14:41;1.559;;;1.659;;1.459;1.549;;;;;;;;;;;;;;;;;;;;CEPSA;P;dm;L-V: 07:00-13:00;L-V: 07:00-13:00 (A);2025-11-20;Petrolera;Alicante/Alacant;Comunitat Valenciana;1881762.0;932018.0;949744.0;1;2;2;4;86;342;1295;47.4084986581561
BENEIXAMA;BENEIXAMA;03460;CALLE DR. SILVESTRE, ;N;-0.76775;38.701889;01/12/2025 10:41;1.489;;;;;1.399;;1.029;;;;;;;;;;;;;;;;;;;COOPERATIVA DIVINA AURORA;P;dm;L-D: 24H;L-D: 24H (A);2025-12-01;Independiente;Alicante/Alacant;Comunitat Valenciana;1881762.0;932018.0;949744.0;1;1;2;7;65;317;1309;48.70595516239793
BENEIXAMA;BENEIXAMA;03460;CARRETERA VILLENA-ALCUDIA KM. 10,608;D;-0.771194;38.698;03/12/2025 14:27;1.479;;;;;1.389;;;;;;;;;;;;;;0.749;;;;;;;GASOLWIN BENEIXAMA;P;dm;L-D: 06:00-22:00;L-D: 06:00-22:00 (P);2025-12-03;Independiente;Alicante/Alacant;Comunitat Valenciana;1881762.0;932018.0;949744.0;1;1;2;6;65;318;1305;48.461283615142364
BENEJÚZAR;BENEJUZAR;03390;CARRETERA JACARILLA KM. S/N;I;-0.843056;38.076944;01/12/2025 11:08;1.609;;;1.669;;1.529;1.629;1.209;;;;;;;;;;;;;;;;;;;REPSOL;P;dm;L-D: 06:00-22:00;L-D: 07:00-21:00 (A);2025-12-01;Petrolera;Alicante/Alacant;Comunitat Valenciana;1881762.0;932018.0;949744.0;0;1;10;42;191;562;950;39.065088860513754
BENIDORM;BENIDORM;03501;CARRETERA N-332 KM. 124,5;I;-0.101917;38.558056;03/12/2025 13:45;1.499;;;1.639;;1.429;1.479;;;;;;;;;;;;;;;;;;;;GALP;P;OM;L-D: 06:00-22:00;L-D: 06:00-22:00 (A);2025-12-03;Petrolera;Alicante/Alacant;Comunitat Valenciana;1881762.0;932018.0;949744.0;3;7;16;38;58;273;780;44.9176965209229
BENIDORM;BENIDORM;03501;AVENIDA VILLAJOYOSA LA, 34;N;-0.16225;38.533639;03/12/2025 00:00;1.599;;;1.749;;1.509;1.609;;;;;;;;;;;;;;;;;;;;BP CALA BENIDORM;P;OM;L-D: 07:00-23:00;L-D: 07:00-23:00 (P);2025-12-03;Petrolera;Alicante/Alacant;Comunitat Valenciana;1881762.0;932018.0;949744.0;5;9;18;35;58;291;801;39.11245913193796
BENIDORM;BENIDORM;03501;CARRETERA CV-70 KM. 47;I;-0.134444;38.559583;03/12/2025 00:00;1.609;;1.679;1.769;;1.519;1.619;;;;;;;1.005;;;;;;;;;;;;;REPSOL;P;OM;L-D: 24H;L-D: 24H (A);2025-12-03;Petrolera;Alicante/Alacant;Comunitat Valenciana;1881762.0;932018.0;949744.0;0;1;25;38;60;292;796;42.81137921671641
BENIDORM;BENIDORM;03501;AVENIDA COMUNIDAD VALENCIANA, 18;D;-0.11925;38.544194;03/12/2025 00:00;1.599;;;1.749;;1.509;1.609;;;;;;;;;;;;;;;;;;;;BP BENIDORM;P;OM;L-D: 24H;L-D: 24H (A);2025-12-03;Petrolera;Alicante/Alacant;Comunitat Valenciana;1881762.0;932018.0;949744.0;0;4;22;38;59;279;779;42.78569379525247
BENIDORM;BENIDORM;03501;CARRETERA N-332 KM. 124,5;D;-0.1015;38.557694;03/12/2025 13:45;1.499;;;1.639;;1.429;1.479;;;;;;;;;;;;;;;;;;;;GALP;P;OM;L-D: 06:00-22:00;L-D: 06:00-22:00 (A);2025-12-03;Petrolera;Alicante/Alacant;Comunitat Valenciana;1881762.0;932018.0;949744.0;3;7;16;38;58;273;779;44.92217121456823
BENIDORM;BENIDORM;03503;AVENIDA COMUNITAT VALENCIANA, 36;N;-0.105389;38.5545;01/12/2025 06:56;1.479;;;;;1.389;;;;;;;;;;;;;;;;;;;;;FUSPRA ENERGY;P;dm;L-D: 24H;Sin datos;2025-12-01;Independiente;Alicante/Alacant;Comunitat Valenciana;1881762.0;932018.0;949744.0;4;6;15;38;58;274;782;44.43809790809307
BENIDORM;BENIDORM;03503;AVENIDA COMUNIDAD VALENCIANA- CAMÍ DEL PALASIET, 2;N;-0.109778;38.551139;26/11/2025 15:01;1.399;;;;;1.359;;;;;;;;;;;;;;;;;;;;;PETROENERGY;P;dm;L-D: 24H;Sin datos;2025-11-26;Independiente;Alicante/Alacant;Comunitat Valenciana;1881762.0;932018.0;949744.0;1;6;16;38;58;276;782;43.908258963810546
BENIDORM;BENIDORM;03503;AVENIDA DOCTOR SEVERO OCHOA, S/N;N;-0.102722;38.543139;03/12/2025 00:00;1.599;;;1.749;;1.509;1.609;;;;;;;;;;;;;;;;;;;;BP EUROBENIDORM;P;OM;L-D: 24H;L-D: 24H (A);2025-12-03;Petrolera;Alicante/Alacant;Comunitat Valenciana;1881762.0;932018.0;949744.0;0;6;14;38;57;273;766;43.875240201107815
BENIDORM;BENIDORM;03502;AVENIDA JAIME I, 23;N;-0.134139;38.541722;03/12/2025 00:00;1.599;;;1.749;;1.509;1.609;;;;;;;;;;;;;;;;;;;;BP LA ISLETA;P;OM;L-D: 24H;L-D: 24H (A);2025-12-03;Petrolera;Alicante/Alacant;Comunitat Valenciana;1881762.0;932018.0;949744.0;0;2;19;39;55;287;787;41.58894535474803
BENIDORM;BENIDORM;03502;POLIGONO APR 3, 68;D;-0.100972;38.558833;01/12/2025 18:00;1.468;;;;;1.343;;;;;;;;;;;;;;0.773;;;;;;;VCC ANOUER;P;dm;L-D: 24H;L-D: 24H (D);2025-12-01;Independiente;Alicante/Alacant;Comunitat Valenciana;1881762.0;932018.0;949744.0;3;7;16;38;58;273;781;45.0354231179883
BENIJÓFAR;BENIJOFAR;03178;CALLE ALICANTE, S/N;D;-0.731222;38.066056;01/12/2025 04:15;1.279;;;;;1.259;;;;;;;;;;;;;;;;;;;;;PLENERGY;P;dm;L-D: 24H;L-D: 24H (D);2025-12-01;Descuento;Alicante/Alacant;Comunitat Valenciana;1881762.0;932018.0;949744.0;2;7;12;48;177;563;925;33.46678743967031
BENIJÓFAR;BENIJOFAR;03178;CALLE ALCALDE FRANCISCO GONZALEZ FERNANDEZ, 32;N;-0.745028;38.077222;03/12/2025 12:59;1.489;;;;;1.399;;;;;;;;;;;;;;;;;;;;;BENIEXPRESS;P;dm;L-D: 24H;L-D: 24H (A);2025-12-03;Petrolera;Alicante/Alacant;Comunitat Valenciana;1881762.0;932018.0;949744.0;0;4;12;37;177;561;932;33.18542343208038
BENISSA;BENISSA;03720;CALLE MARGENADORS DELS, 8;N;0.059389;38.718611;01/12/2025 10:37;1.479;;;;;1.327;;;;;;;;;;;;;;;;;;;;;ROSELLO;P;dm;L-S: 08:00-20:00;L-S: 08:00-20:00 (A);2025-12-01;Independiente;Alicante/Alacant;Comunitat Valenciana;1881762.0;932018.0;949744.0;3;3;4;30;86;188;829;67.12172569743038
BENISSA;BENISSA;03720;AVENIDA EUROPA, 8;D;0.060194;38.718139;03/12/2025 00:00;1.609;;;1.759;;1.519;1.619;;;;;;;;;;;;;;;;;;;;BP BENISSA;P;OM;L-D: 06:00-22:00;L-D: 06:00-22:00 (P);2025-12-03;Petrolera;Alicante/Alacant;Comunitat Valenciana;1881762.0;932018.0;949744.0;3;3;4;30;86;187;828;67.13840921778635
BENISSA;BENISSA;03720;CARRETERA MORAIRA-CALPE KM. 3;D;0.105778;38.677722;01/12/2025 17:47;1.444;;;;;1.344;;;;;;;;;;;;;;;;;;;;;VCC BENISSA;P;dm;L-D: 24H;L-D: 24H (A);2025-12-01;Petrolera;Alicante/Alacant;Comunitat Valenciana;1881762.0;932018.0;949744.0;0;0;4;18;81;165;747;67.33611313155909
BENISSA;BENISSA;03720;AVENIDA EUROPA, 12;D;0.059861;38.717667;03/12/2025 10:03;1.499;;;;;1.379;;;;;;;;;;;;;;;;;;;;;PLENERGY;P;dm;L-D: 24H;L-D: 24H (D);2025-12-03;Descuento;Alicante/Alacant;Comunitat Valenciana;1881762.0;932018.0;949744.0;3;3;4;30;86;187;829;67.08181355201157
BENISSA;BENISSA;03720;AVENIDA LAS MARINAS, 290;D;0.084944;38.665889;03/12/2025 10:44;1.449;;;;;1.349;1.359;;;;;;;;;;;;;;;;;;;;BALLENOIL;P;OM;L-D: 24H;L-D: 24H (D);2025-12-03;Descuento;Alicante/Alacant;Comunitat Valenciana;1881762.0;932018.0;949744.0;0;0;8;16;82;178;753;65.0997336271773
BENISSA;BENISSA;03720;AVINGUDA EUROPA, 34;D;0.060556;38.719222;01/12/2025 01:44;1.579;;;;;1.459;;;;;;;;1.0;;;;;;1.0;;;;;;;MASOIL BENISA;P;dm;L-D: 24H;L-D: 24H (A);2025-12-01;Petrolera;Alicante/Alacant;Comunitat Valenciana;1881762.0;932018.0;949744.0;3;3;4;30;86;187;827;67.24239762895401
BENITACHELL/POBLE NOU DE BENITATXELL (EL);BENITACHELL;03726;CARRETERA CV-740 KM. 6,800;I;0.152139;38.738972;01/12/2025 11:25;1.599;;;1.699;;1.469;;;;;;;;1.029;;;;;;;;;;;;;(SIN RÓTULO);P;dm;L-D: 07:00-22:00;L-D: 07:00-22:00 (P);2025-12-01;Independiente;Alicante/Alacant;Comunitat Valenciana;1881762.0;932018.0;949744.0;1;1;5;24;61;150;760;74.70313588146146
BIAR;BIAR;03410;CARRETERA ALCOY - VILLENA KM. 38,2;N;-0.786556;38.630583;03/12/2025 00:00;1.549;;;1.669;;1.519;;1.199;;;;;;;;;;;;;1.609;;;;;;REPSOL;P;dm;"L-V: 07:00-21:30; S: 07:00-15:30";"L-V: 07:00-21:30 (P); S: 07:00-15:30 (P)";2025-12-03;Petrolera;Alicante/Alacant;Comunitat Valenciana;1881762.0;932018.0;949744.0;0;0;0;14;64;330;1240;42.71739181456336
BIGASTRO;BIGASTRO;03380;CALLE DEL PROGRESO, 24;D;-0.884611;38.059056;01/12/2025 11:55;1.449;;;;;1.359;;;;;;;;;;;;;;1.0;;;;;;;BIGASOIL;P;dm;L-D: 24H;L-D: 24H (A);2025-12-01;Independiente;Alicante/Alacant;Comunitat Valenciana;1881762.0;932018.0;949744.0;1;2;9;33;227;585;950;43.106678778059226
BIGASTRO;BIGASTRO;03380;POLIGONO SECTOR D10, 8;D;-0.899;38.064861;03/12/2025 09:45;1.429;;;;;1.349;;;;;;;;;;;;;;;;;;;;;PLENERGY;P;dm;L-D: 24H;L-D: 24H (D);2025-12-03;Descuento;Alicante/Alacant;Comunitat Valenciana;1881762.0;932018.0;949744.0;0;2;11;35;233;578;952;43.65493493077967
BIGASTRO;BIGASTRO;03380;POLIGONO APATEL, 6;D;-0.885222;38.059194;02/12/2025 12:23;1.569;;;1.709;;1.489;1.589;;;;;;;;;;;;;;;;;;;;REPSOL;P;dm;L-D: 06:00-22:00;L-D: 06:00-22:00 (A);2025-12-02;Petrolera;Alicante/Alacant;Comunitat Valenciana;1881762.0;932018.0;949744.0;1;2;9;33;227;585;950;43.13705716725533
BUSOT;BUSOT;03111;CALLE EL PI, 1;I;-0.424194;38.477806;01/12/2025 19:43;1.559;;;;;1.469;;;;;;;;;;;;;;0.999;;;;;;;ATLANTIS EXPRESS;P;dm;L-D: 24H;L-D: 24H (A);2025-12-01;Independiente;Alicante/Alacant;Comunitat Valenciana;1881762.0;932018.0;949744.0;0;0;0;23;122;344;1009;19.890352764695685
CALLOSA DE SEGURA;CALLOSA DE SEGURA;03360;BARRIO SAN JOSE DRCHA, 70;D;-0.858917;38.130583;01/12/2025 11:09;1.449;;;;;1.399;1.429;;;;;;;;;;;;;;;;;;;;RITOR DIESEL;P;dm;L-D: 07:30-21:30;L-D: 07:30-21:30 (P);2025-12-01;Independiente;Alicante/Alacant;Comunitat Valenciana;1881762.0;932018.0;949744.0;2;2;17;49;195;567;960;36.480114272279025
CALLOSA DE SEGURA;CALLOSA DE SEGURA;03360;CARRETERA CATRAL KM. 0,300;D;-0.861861;38.12775;03/12/2025 00:01;1.559;;;1.709;;1.509;1.609;;;;;;;;;;;;;0.8;;;;;;;BP OIL ESPAÑA, S.A.U.;P;dm;"L-V: 06:00-22:00; S-D: 07:00-22:00";"L-V: 06:00-22:00 (A); S-D: 07:00-22:00 (A)";2025-12-03;Petrolera;Alicante/Alacant;Comunitat Valenciana;1881762.0;932018.0;949744.0;2;2;13;49;196;567;958;36.86949874938509
CALLOSA DE SEGURA;CALLOSA DE SEGURA;03360;CARRETERA N-340 KM. 692,9;D;-0.927583;38.143139;03/12/2025 00:00;1.569;;;;;1.529;;;;;;;;;;;;;;;1.619;;;;;;PETRONOR;P;OM;"L-V: 06:00-22:00; S: 07:00-15:00; D: 08:00-14:00";"L-V: 06:00-22:00 (A); S: 07:00-15:00 (A); D: 08:00-14:00 (A)";2025-12-03;Petrolera;Alicante/Alacant;Comunitat Valenciana;1881762.0;932018.0;949744.0;0;0;12;35;202;565;963;40.941697268165264
CALLOSA DE SEGURA;CALLOSA DE SEGURA;03360;CARRETERA CV913 KM. 1;D;-0.867333;38.125694;01/12/2025 01:46;1.539;;;1.669;;1.509;1.619;;;;;;;;;;;;;;;;;;;;REPSOL;P;dm;L-D: 06:00-22:00;L-D: 06:00-22:00 (A);2025-12-01;Petrolera;Alicante/Alacant;Comunitat Valenciana;1881762.0;932018.0;949744.0;2;2;13;50;196;566;955;37.39427182763323
CALLOSA D'EN SARRIÀ;CALLOSA D'EN SARRIA;03510;CALLE SAN ISIDRO, 10;D;-0.121194;38.6495;27/11/2025 08:58;1.629;;;1.739;;1.519;1.649;1.239;;;;;;;;;;;;;;;;;;;REPSOL;P;dm;L-D: 07:00-22:00;L-D: 07:00-22:00 (A);2025-11-27;Petrolera;Alicante/Alacant;Comunitat Valenciana;1881762.0;932018.0;949744.0;0;0;2;16;79;304;917;50.57514450459521
CALPE/CALP;CALPE;03710;CALLE L ESPORT, 2;D;0.050278;38.645444;02/12/2025 11:32;1.599;;;1.759;;1.499;;;;;;;;;;;;;;1.65;1.599;;;;;;REPSOL;P;dm;L-D: 24H;L-D: 24H (A);2025-12-02;Petrolera;Alicante/Alacant;Comunitat Valenciana;1881762.0;932018.0;949744.0;3;6;7;16;92;189;761;61.32755067080966
CALPE/CALP;CALPE;03710;AVENIDA DEL PORT, 15/41;N;0.06925;38.637306;01/12/2025 11:08;1.479;;;;;1.379;1.479;;;;;;;;;;;;;;;;;;;;COFRADIA DE PESCADORES;P;dm;L-V: 08:30-13:30 y 15:00-19:00;L-V: 08:30-13:30 (P), 15:00-19:00 (P);2025-12-01;Independiente;Alicante/Alacant;Comunitat Valenciana;1881762.0;932018.0;949744.0;0;2;7;16;91;182;727;62.12397622029223
CALPE/CALP;CALPE;03710;AVENIDA AV DIPUTACION S/N, ;N;0.040556;38.646306;03/12/2025 14:00;1.539;;;1.699;;1.449;1.519;;;;;;;;;;;;;;;;;;;;Q8;P;dm;L-D: 24H;Sin datos;2025-12-03;Descuento;Alicante/Alacant;Comunitat Valenciana;1881762.0;932018.0;949744.0;5;5;7;15;95;195;778;60.71335183656181
CALPE/CALP;CALPE;03710;PARTIDA ESTACION II, 6;I;0.037806;38.652972;01/12/2025 16:05;1.499;;;1.639;;1.419;1.439;;;;;;;;;;;;;1.2;;;;;;;CALPE AUTOMOCION II;P;dm;L-D: 24H;L-D: 24H (A);2025-12-01;Independiente;Alicante/Alacant;Comunitat Valenciana;1881762.0;932018.0;949744.0;3;5;7;17;94;195;796;60.97973833711715
CALPE/CALP;CALPE;03710;AVINGUDA VALL DE LAGUART, 5;D;0.051139;38.64575;01/12/2025 11:58;1.469;;;;;1.379;;;;;;;;;;;;;;;;;;;;;AUTOFUEL LOW COST;P;dm;L-D: 24H;L-D: 24H (A);2025-12-01;Independiente;Alicante/Alacant;Comunitat Valenciana;1881762.0;932018.0;949744.0;3;6;7;17;92;189;760;61.40776088668069
CALPE/CALP;CALPE;03710;AVENIDA DIPUTACION, 35;D;0.04175;38.646306;01/12/2025 10:13;1.469;;;;;1.379;;;;;;;;;;;;;;;;;;;;;GASEXPRESS;P;dm;L-D: 24H;L-D: 24H (A);2025-12-01;Descuento;Alicante/Alacant;Comunitat Valenciana;1881762.0;932018.0;949744.0;5;5;7;15;95;195;775;60.79563304713053
CALPE/CALP;CALPE;03710;PARTIDA ESTACION II, 6;D;0.037306;38.653028;01/12/2025 16:06;1.489;;;1.629;;1.399;1.409;;;;;;;;;;;;;;;;;;;;CALPE AUTOMOCION;P;dm;L-D: 24H;L-D: 24H (A);2025-12-01;Independiente;Alicante/Alacant;Comunitat Valenciana;1881762.0;932018.0;949744.0;3;5;7;17;96;195;798;60.94948028280751
CAMPELLO (EL);CAMPELLO (EL);03560;CALLE INFANTA, 31;N;-0.401389;38.424083;01/12/2025 11:00;1.579;;1.679;;;1.499;1.599;;;;;;;;;;;;;;;;;;;;CAMPELLO - GOTETA II;P;dm;"L-V: 06:00-23:00; S-D: 07:00-23:00";"L-V: 06:00-23:00 (A); S-D: 07:00-23:00 (A)";2025-12-01;Independiente;Alicante/Alacant;Comunitat Valenciana;1881762.0;932018.0;949744.0;3;4;20;39;116;344;1005;15.682146274327948
CAMPELLO (EL);CAMPELLO (EL);03560;CALLE SAN RAMON 8, ;D;-0.406444;38.424639;01/12/2025 21:40;1.579;;;;;1.499;1.559;;;;;;;;;;;;;;;;;;;;REPSOL-RIO SECO;P;dm;L-D: 06:30-22:00;L-D: 06:30-22:00 (A);2025-12-01;Petrolera;Alicante/Alacant;Comunitat Valenciana;1881762.0;932018.0;949744.0;2;7;20;46;116;347;1007;15.466347413873802
CAMPELLO (EL);CAMPELLO (EL);03560;URBANIZACIÓN ABAYNA, 21;D;-0.387389;38.439556;03/12/2025 12:51;1.429;;;;;1.349;;;;;;;;;;;;;;;;;;;;;PETROPRIX;P;dm;L-D: 24H;L-D: 24H (D);2025-12-03;Descuento;Alicante/Alacant;Comunitat Valenciana;1881762.0;932018.0;949744.0;0;4;13;30;111;339;994;17.78935181275223
